,item_name,category
5632,surecure 5 in 1 facial cleansing brush system teal,Bath & Body
5633,philosophy renewed hope in a jar complete concealer 0.5 oz 6.5 tan beige,Bath & Body
5634,north american health and wellness night time bunion corrector,Bath & Body
5635,deago 0.25 1.5mm microneedle derma roller dermaroller needle skin care usa 1.0mm,Bath & Body
5636,passport to organics caffeine eye cream 0.5 fl. oz. white/brown/dark,Bath & Body
5637,philosophy turbo booster c powder 0.25 oz white/brown,Bath & Body
5638,riah fashion stella face mask 12 pack coconut oil red,Bath & Body
5639,hempz pure herbal extracts moisturizer 17oz and 2oz set various scents green tea asian pear,Bath & Body
5640,men 039 s bad baby bad baby hair care pen products dry shampoo flexi firm hairspray hair mergency,Bath & Body
5641,erisonic facial cleansing and massage system lavender,Bath & Body
5642,burt 039 s bees tips toes kit 6 pc kit white/green,Bath & Body
5643,powerstep pinnacle maxx orthotic insoles alphanumeric string 20 character max // 1 pair red,Bath & Body
5644,obagi obagi360 exfoliating cleanser 5.1 oz all skin types blue,Bath & Body
5645,qpower premium best gold collagen peel off mask rose 1 pack all skin types pink/red/yellow,Bath & Body
5646,venwraps detox slimming bodysuit large,Bath & Body
5647,sparoom breathe aromatherapy inhaler alert,Bath & Body
5648,beekman 1802 goat milk bar soap 9 oz white fragrance white water,Bath & Body
5649,proraso emollient and nourishing shaving soap with sandalwood oil shea butter 5.2 oz yellow,Bath & Body
5650,hot shapers plus size slimming waist belt with firming gel 4xl 4 oz black,Bath & Body
5651,n.v. perricone m.d. perricone md nutritive cleanser 6 oz normal blue/gray/brown,Bath & Body
5652,ms dear ultimate peel off face mask collection 6 pack,Bath & Body
5653,all good natural deodorant tea tree basil 2.5 oz stick,Bath & Body
5654,dermalogica multi active toner 16 oz normal red/purple/blue/green/brown,Bath & Body
5655,primal elements sugar whip moisturizing body scrubs 10 oz grapefruit white,Bath & Body
5656,lilash purified eyelash eyebrow growth stimulator serum 1 or 2 pcs 1 pack gray,Bath & Body
5657,mychelle sun shield spf 28 coconut sunscreen 2.3 oz tube,Bath & Body
5658,jason natural vitamin e oil 5 000 iu 4 oz bottle,Bath & Body
5659,skin pasion lavender bath body oil 2 piece deluxe bonus set purple/natural,Bath & Body
5660,dermedicine advanced skincare dermedicine vitamin c antioxidant lip therapy 0.06 fl oz,Bath & Body
5661,erisonic facial cleansing and massage system white,Bath & Body
5662,hot shapers waist trimmer cami with hot sweat gel xl 4 oz black,Bath & Body
5663,opi avojuice ginger lily hand body lotion 8.5 oz coconut red,Bath & Body
5664,elizabeth arden prevage anti aging neck decollete firm and repair cream 1.7 oz all skin types white,Bath & Body
5665,trulyclear bee venom under eye cream all skin types white/natural,Bath & Body
5666,earth science clarifying facial wash 8 oz bottle,Bath & Body
5667,alba botanica unscented very emollient body lotion 32 oz bottle,Bath & Body
5668,men 039 s the art of shaving creams 1.5 oz sandalwood white,Bath & Body
5669,jason hand and body lotion aloe vera 8 fl oz,Bath & Body
5670,nubian heritage body wash goat 039 s milk and chai 13 fl oz,Bath & Body
5671,lubriderm fragrance free moisturizing lotion 16 oz. enriched with vitamin b5 and skin essential moisturizers part no. 1044940 qty 1,Bath & Body
5672,pure and basic body wash passionate pear 12 oz,Bath & Body
5673,scaramouche fandango shampoo 200 ml 6.76 oz hair care,Bath & Body
5674,pure tulsi powder 100 grams,Bath & Body
5675,one with nature dead sea mineral restorative hand and body lotion lavender 12 fl oz,Bath & Body
5676,pall mall barbers sandalwood clove beard oil 1.05 oz 30 ml hair care pmb bo 001,Bath & Body
5677,tame the beast light musk beard hair body wash 12 oz 355 ml hair care n1 iomm z6q1,Bath & Body
5678,gucci pour homme sport all over shampoo 1.6 oz 47.3 ml 502404,Bath & Body
5679,olivella body lotion 6.76 fl oz,Bath & Body
5680,yakshi fragrances roll on fragrance himalayan rose 0.32 fl oz,Bath & Body
5681,dr. chen deep moisture lotion,Bath & Body
5682,kandesn cleansing cream,Bath & Body
5683,kandesn shampoo,Bath & Body
5684,ren moroccan rose otto sugar body polish,Bath & Body
5685,tattoo eyebrow ruler eyebrow beauty three point makeup symmetrical tool black,Body Art
5686,6 colors romantic bear lip wow gloss tattoo magic peel mask tint long,Body Art
5687,mehron makeup tattoo cover 5 shades multi color,Body Art
5688,hugger mugger yoga block bamboo 1 each,Fitness
5689,natural fitness pro burst resistant exercise ball medium olive 1 each,Fitness
5690,cuccio somatology yogahhh milk bath 16 oz pouch,Fitness
5691,plasticade gemstone rubber base 20 lb. for gemstone vertical panel model 400 b 20r black,Fitness
5692,crescent moon eva the all foam snowshoes,Fitness
5693,natural fitness roam folding yoga mat 1 each,Fitness
5694,yoga design lab thrive market mandala rose towel 1 each,Fitness
5695,lifeline monster walk band 40lb resistance 1 each,Fitness
5696,natural fitness pro burst resistant exercise ball small plum 1 each,Fitness
5697,crescent moon eva the all foam snowshoes,Fitness
5698,lax gadgets laudfit water resistant sweatproof smart fitness tracker band blue/1 pack black,Fitness
5699,hot shapers unisex waist trimmer ab belt 2xl black,Fitness
5700,self fitness exercise stability ball with pump pink,Fitness
5701,gold 039 s gym 20 foot training rope yellow,Fitness
5702,black mountain products barbell clamps with quick release for 2inch olympic bars blue,Fitness
5703,bluestone compression sleeves medium/white,Fitness
5704,sunny health fitness vinyl coated kettle bell 10ibs yellow,Fitness
5705,sisyama neoprene sauna sweat workout hot wet suit unisex weight loss pink small,Fitness
5706,cando hand therapy strengthening webs large/blue 1 pack blue,Fitness
5707,cando hand therapy strengthening webs large/tan 1 pack brown,Fitness
5708,black mountain products exercise balance stability disc with hand pump yellow,Fitness
5709,sports research stability ball various sizes and colors blue 55 cm,Fitness
5710,2000lbs static strength exercise stability ball with pump 85cm purple,Fitness
5711,topeakmart 30/40/50ft 1.5 sport train battle power rope bootcamp exercise fit 30ft,Fitness
5712,wacces neoprene dipped coated set of 2 dumbbells hand weights sets 12 lb,Fitness
5713,nordictrack 20lb. weighted vest,Fitness
5714,weider pro lifting straps,Fitness
5715,hot shapers hot waist trimmer black body shaper slimmer belt 3xl,Fitness
5716,pharmedoc yoga blocks 2 pack grey/large,Fitness
5717,cando balance disc yellow/14,Fitness
5718,pair of aqua fit training swim gloves blue,Fitness
5719,myprosupports waist trimmer lower back support fat burner pink large/xl,Fitness
5720,running power chute speed training resistance parachute,Fitness
5721,bionic body resistance tube blue 30 pounds,Fitness
5722,black mountain products hand therapy balls 3 pack,Fitness
5723,proform contoured pushup stands red,Fitness
5724,workout gloves with wrist support and grip pink large,Fitness
5725,pilates pro chair with 4 workout dvds by life 039 s a beach refurbished blue,Fitness
5726,zennery deluxe non slip yoga exercise mat dark blue,Fitness
5727,the source force non skid yoga towel with carrying bag blue,Fitness
5728,wacces neoprene dipped coated set of 2 dumbbells hand weights sets 6 lb,Fitness
5729,ifitness activity pedometer wireless watch with interchangeable band light blue/black,Fitness
5730,iron gym upper body workout bar,Fitness
5731,merkury innovations body glove yoga/fitness mats midnight select yoga mat blue,Fitness
5732,olympiada gear olympiada premium latex pull up resistance fitness bands red 10 to 35lbs,Fitness
5733,topeakmart leg knee pad sleeve protector gear basketball antislip black l,Fitness
5734,black mountain products stretch strap with instruction guide black,Fitness
5735,bintiva yoga kit purple 4 piece,Fitness
5736,bintiva resistance band set 10 piece,Fitness
5737,oyoga extra thick exercise nbr yoga pilates mat w/ bag 72 x 24 10mm black,Fitness
5738,the source force non skid yoga towel with carrying bag purple,Fitness
5739,proform 440 r rowing machine,Fitness
5740,cando hand therapy strengthening webs small/yellow 1 pack yellow,Fitness
5741,merkury innovations body glove yoga/fitness mats flamingo pink extra thick fitness map with carry strap,Fitness
5742,zennery deluxe non slip yoga exercise mat purple,Fitness
5743,black mountain products resistance band protective sleeve black,Fitness
5744,dg sports 13 inch yoga wheel provides support for poses aids with stretching in site white out site black,Fitness
5745,men 039 s spencertoys men body shapers vest sauna sweat suits shaperwear fitness corset tops l,Fitness
5746,black mountain products aquatic exercise water dumbbells set of 2 pink,Fitness
5747,power belt xtreme shaper slimming belt orange xl orange,Fitness
5748,cuttingedgebargains inc fitness twister stepper with resistance bands cardio stepper stair step machine black new,Fitness
5749,merkury innovations body glove active dumbbells kettlebells grey 15lb kettlebell,Fitness
5750,proform hand grips,Fitness
5751,stamina products bodytrac glider 1050 rowing machine,Fitness
5752,gaiam 6mm reversible print yoga mat 6mm multi color gaiam yoga mat 6mm reversible caspian trance,Fitness
5753,wacces neoprene dipped coated set of 2 dumbbells hand weights sets 1 lb,Fitness
5754,workout gloves with wrist support and grip black xx large,Fitness
5755,2 pocket running belt pg93765 red,Fitness
5756,cutting edge bargains unisex waist trimmer ab belt stomach wrap for faster weight loss blue,Fitness
5757,pharmedoc yoga blocks 2 pack grey/small,Fitness
5758,proform compact step deck red,Fitness
5759,bintiva anti burst exercise ball purple 75cm,Fitness
5760,hedstrom fitness kamagon water filled adjustable weight kettlebell blue,Fitness
5761,merkury innovations body glove yoga/fitness mats deep aquatic essential yoga mat blue,Fitness
5762,bionic body resistant band ankle/wrist strap bbas 015 label nylon,Fitness
5763,swaga boxing hand wraps red 1 pair,Fitness
5764,hot shapers unisex waist trimmer ab belt xl black,Fitness
5765,marcy folding motorized treadmill jx 651bw new lcd display,Fitness
5766,self fitness exercise stability ball with pump champagne,Fitness
5767,cando plus foam roller 6 x 12,Fitness
5768,hedstrom fitness kamagon water filled adjustable weight kettlebell purple,Fitness
5769,weider weight plate storage rack gray,Fitness
5770,bionic body soft kettle bell with handle various weights 10 pounds,Fitness
5771,cando hand therapy strengthening webs small/black 1 pack black,Fitness
5772,black mountain products exercise balance stability disc with hand pump purple,Fitness
5773,proform dumbbell set 9 piece,Fitness
5774,zennery deluxe non slip yoga exercise mat orange,Fitness
5775,proform treadmill accessory kit,Fitness
5776,hourglass trainer workout weight belt pink/small medium,Fitness
5777,vfish high performance non slip grip barre pilates and yoga socks 2 packs be anchored coral be anchored lime orange/red/green,Fitness
5778,workout gloves with wrist support and grip pink xx large,Fitness
5779,black mountain products single resistance band with door anchor 2 4 lbs yellow black/yellow,Fitness
5780,dg sports microfiber yoga towel green stich,Fitness
5781,stamina products stamina studio barre,Fitness
5782,cando balance disc yellow/24,Fitness
5783,pure body logix yoga socks s/m black with toe,Fitness
5784,black mountain products foldable agility ladder with carry bag multi color 4 meter 13 foot,Fitness
5785,core exercise sliders. set of 2 gliding discs green,Fitness
5786,men 039 s hot shapers sport hot abs men 039 s compression body shaper belt small black,Fitness
5787,garmin forerunner 210,Fitness
5788,boucheron jaipur homme eau de toilette 50 ml,Fragrance
5789,donna karan be delicious eau de toilette 50 ml,Fragrance
5790,calvin klein euphoria after shave 100 ml,Fragrance
5791,burberry burberry touch eau de toilette 30 ml,Fragrance
5792,vera wang vera wang for men eau de toilette 100 ml,Fragrance
5793,calvin klein ck free eau de toilette 100 ml,Fragrance
5794,calvin klein ck one shock for her eau de toilette 200 ml,Fragrance
5795,guerlain shalimar eau de toilette 30 ml,Fragrance
5796,dolce gabbana dolce floral drops eau de toilette 50 ml,Fragrance
5797,joop joop homme eau de toilette 75 ml,Fragrance
5798,bvlgari omnia amethyste eau de toilette 65 ml,Fragrance
5799,christian dior hypnotic poison eau de toilette 30 ml,Fragrance
5800,viktor rolf flower bomb eau de parfum 100 ml,Fragrance
5801,elizabeth arden red door eau de toilette 100 ml,Fragrance
5802,lancome poeme eau de parfum 100 ml,Fragrance
5803,dolce gabbana light blue living stromboli eau de toilette 125 ml,Fragrance
5804,estee lauder pleasures men eau de toilette 50 ml,Fragrance
5805,fendi fan di fendi acqua eau de toilette 100 ml,Fragrance
5806,dolce gabbana light blue eau de toilette 75 ml,Fragrance
5807,giorgio armani emporio remix eau de toilette 100 ml,Fragrance
5808,paco rabanne xs eau de toilette 50 ml,Fragrance
5809,boucheron jaipur homme eau de toilette 100 ml,Fragrance
5810,dolce gabbana le bateleur 1 eau de toilette 100 ml,Fragrance
5811,la prairie life threads ruby eau de parfum 50 ml,Fragrance
5812,michael kors white eau de parfum 30 ml,Fragrance
5813,estee lauder wood mystique eau de parfum 100 ml,Fragrance
5814,givenchy dahlia noir l eau eau de toilette 90 ml,Fragrance
5815,roberto cavalli paradiso eau de parfum 75 ml,Fragrance
5816,lacoste sensuelle eau de parfum 30 ml,Fragrance
5817,tous in heaven her eau de toilette 100 ml,Fragrance
5818,antonio banderas spirit antonio banderas for women eau de toilette 100 ml,Fragrance
5819,dolce gabbana 21 le fou eau de toilette 100 ml,Fragrance
5820,iceberg twice eau de toilette 75 ml,Fragrance
5821,burberry sport for women eau de toilette 50 ml,Fragrance
5822,salvatore ferragamo subtil pour homme eau de toilette 50 ml,Fragrance
5823,yves saint laurent baby doll eau de toilette 50 ml,Fragrance
5824,hugo boss boss orange man eau de toilette 50 ml,Fragrance
5825,britney spears curious eau de parfum 100 ml,Fragrance
5826,hugo boss the scent intense eau de parfum 100 ml,Fragrance
5827,davidoff the brilliant game eau de toilette 100 ml,Fragrance
5828,cartier roadster sport eau de toilette 30 ml,Fragrance
5829,kenzo kenzo homme sport extreme eau de toilette 100 ml,Fragrance
5830,benetton inferno paradiso blue man eau de toilette 100 ml,Fragrance
5831,cadillac black eau de toilette 100 ml,Fragrance
5832,guerlain homme l eau boisee eau de toilette 80 ml,Fragrance
5833,carolina herrera 212 vip men club edition eau de toilette 100 ml,Fragrance
5834,joop go eau de toilette 100 ml,Fragrance
5835,light blue love in capri for women by dolce gabbana eau de toilette spray 3.4 oz,Fragrance
5836,alfred dunhill desire eau de toilette spray 3.4 oz 100.55 ml shower gel 3 oz 88.72 ml after shave balm 3 oz 88.72 ml,Fragrance
5837,givenchy xeryus eau de toilette spray 1.6 oz 47.31 ml men 039 s fragrance 402596,Fragrance
5838,kenneth cole reaction after shave gel 3.4 oz 100.55 ml fragrance 451731,Fragrance
5839,byblos in black eau de parfum spray 3.4 oz 100 ml men 039 s fragrance 481468,Fragrance
5840,air val pokemon eau de toilette spray 1.7 oz 50.28 ml men 039 s fragrance 467045,Fragrance
5841,ralph lauren big pony red eau de toilette spray tester 4.2 oz 124.2 ml men 039 s fragrance 514503,Fragrance
5842,alfred dunhill 51.3n eau de toilette spray 3.4 oz 100 ml after shave balm 5 oz 148 ml gift set fragrances 502029,Fragrance
5843,cacharel eau de toilette spray 3.4 oz 100.55 ml men 039 s fragrance 413991,Fragrance
5844,vito ballare don ballare padrino eau de toilette spray 3.3 oz 97.59 ml men 039 s fragrances 537664,Fragrance
5845,polo red intense eau de parum spray 4.2 oz 124.2 ml men 039 s fragrance 517941,Fragrance
5846,burberry brit rhythm eau de toilette spray tester 3 oz 88.72 ml men 039 s fragrance 514595,Fragrance
5847,aramis cologne eau de toilette spray tester 3.4 oz 100 ml fragrances 445897,Fragrance
5848,nautica classic eau de toilette spray tester 1.7 oz 50.3 ml fragrance 500405,Fragrance
5849,serge lutens bois de violette eau de parfum spray unisex 1.69 oz 50 ml fragrance 492941,Fragrance
5850,etienne aigner private number mini edt 0.17 oz 5 ml men 039 s fragrance 460649,Fragrance
5851,coty wild spice cologne 0.5 oz 14.8 ml fragrance 491407,Fragrance
5852,gucci guilty eau de toilette spray tester 3 oz 88.7 ml fragrance 499601,Fragrance
5853,paris hilton cologne spray 1.7 oz 50.28 ml men 039 s fragrance 497447,Fragrance
5854,narciso rodriguez eau de toilette spray 1.7 oz 50.28 ml men 039 s fragrance 443329,Fragrance
5855,hugo boss mini edt 0.17 oz 5 ml men 039 s fragrance 414049,Fragrance
5856,hanae mori eau de toilette spray 3.4 oz 100.55 ml men 039 s fragrance 413895,Fragrance
5857,myrurgia yacht man breeze eau de toilette spray 3.4 oz 100.55 ml men 039 s fragrance 529001,Fragrance
5858,benetton sport eau de toilette spray tester 3.3 oz 100 ml fragrances 466150,Fragrance
5859,salvatore ferragamo f free time eau de toilette spray 3.4 oz 100.55 ml toiletry bag gift set fragrance 501032,Fragrance
5860,guerlain habit rouge eau de toilette spray 6.8 oz 200 ml fragrances 503297,Fragrance
5861,perfumers workshop samba zipped eau de toilette spray 1 oz 29.57 ml men 039 s fragrances 401339,Fragrance
5862,maurer wirtz tabac after shave 3.4 oz 100.55 ml men 039 s fragrance 401866,Fragrance
5863,krizia moods after shave 1.7 oz 50.28 ml men 039 s fragrance 455677,Fragrance
5864,calvin klein one body lotion/ skin moisturizer 8.5 oz 250 ml men 039 s fragrance 400508,Fragrance
5865,pascal morabito pure essence eau de toilette spray 3.4 oz 100.55 ml men 039 s fragrances 539232,Fragrance
5866,gianfranco ferre new after shave lotion 3.4 oz 100.55 ml men 039 s fragrances 534440,Fragrance
5867,tommy hilfiger th bold eau de toilette spray 3.4 oz 100.55 ml men 039 s fragrance 533815,Fragrance
5868,paco rabanne black xs vial sample 0.04 oz 1.2 ml fragrance 500546,Fragrance
5869,versace dreamer eau de toilette spray tester 3.4 oz 100.55 ml men 039 s fragrance 445993,Fragrance
5870,kenneth cole mankind ultimate eau de toilette spray 3.4 oz 100.55 ml men 039 s fragrance 533719,Fragrance
5871,penhaligon 039 s elixir eau de toilette spray unisex 3.4 oz 100.55 ml men 039 s fragrance 515006,Fragrance
5872,dolce gabbana le bateleur 1 vial sample 0.05 oz 1.5 ml fragrance 499368,Fragrance
5873,caribbean joe island supply eau de toilette spray 3.4 oz 100.55 ml men 039 s fragrances 539008,Fragrance
5874,chanel allure homme sport 3 x mini edt spray 0.7 oz 20.70 ml 2 refills men 039 s fragrances 536149,Fragrance
5875,lacoste elegence after shave balm 2.5 oz 73.93 ml men 039 s fragrance 458479,Fragrance
5876,english laundry arrogant eau de toilette spray 3.4 oz 100 ml men 039 s fragrance 462373,Fragrance
5877,chanel bleu eau de parfum spray 3.4 oz 100.55 ml men 039 s fragrance 533694,Fragrance
5878,songo jade east cologne spray 4 oz 118.29 ml men 039 s fragrance 456063,Fragrance
5879,lanvin eau de toilette spray 1.7 oz 50.28 ml men 039 s fragrance 418081,Fragrance
5880,loris azzaro chrome eau de toilette spray 6.8 oz 200 ml men 039 s fragrance 418640,Fragrance
5881,hugo boss element after shave unboxed 2 oz 60 ml fragrances 503421,Fragrance
5882,versace eros pour femme eau de toilette 100 ml,Fragrance
5883,gucci guilty studs eau de toilette 90 ml,Fragrance
5884,marc jacobs dot eau de parfum 100 ml,Fragrance
5885,givenchy dahlia noir eau de parfum 50 ml,Fragrance
5886,issey miyake nuit d issey eau de toilette 75 ml,Fragrance
5887,paul smith rose eau de parfum 100 ml,Fragrance
5888,nausea motion sickness medication mirtazapine 10mg/ml 30ml liq. by aps product intended for cats or dogs,Medicine
5889,nausea motion sickness medication mirtazipine 5mg/ml 15ml liq. by aps product intended for cats or dogs,Medicine
5890,northern tool equipment adjustable shop stool with backrest black,Medicine
5891,optimum optical unisex reading glasses moxie black/ 2.00 black,Medicine
5892,bamboo comfort dynamic knee compression sleeve support red medium/1 pack red,Medicine
5893,men 039 s optimum optical mens reading glasses lasalle/ 3.00,Medicine
5894,women 039 s optimum optical womens glasses expressionist/ 1.50 black,Medicine
5895,pch life reusable hot and cold therapy eye mask pink,Medicine
5896,knee high travel socks unisex knee high travel socks black large/xl 5 pack black,Medicine
5897,cuttingedgebargains inc new compression socks medical stockings for men and women athletic sports nurses grey l/xl cream,Medicine
5898,zip up open toe compression socks for men and women extra large,Medicine
5899,cando orthopedic back stretcher 1 natural,Medicine
5900,optimum optical unisex reading glasses morgan black/ 2.25 black,Medicine
5901,cuttingedgebargains inc new recovery knee compression sleeve support knee brace for joint pain relief black,Medicine
5902,men 039 s extreme fit men 039 s compression and body support undershirt gray/medium,Medicine
5903,bookishbunny orthopedic memory foam seat home office chair wheelchair cushion brown,Medicine
5904,ever ready first aid adult and infant cpr mask combo kit with 2 valves,Medicine
5905,optimum optical unisex reading glasses fairways red/ 1.25 red,Medicine
5906,women 039 s optimum optical womens glasses tango/ 2.00,Medicine
5907,dcf unisex arm compression sleeves for athletes 2 pack black/medium,Medicine
5908,bookishbunny memory foam orthopedic pain relief seat and back support cushion set grey,Medicine
5909,women 039 s optimum optical womens reading glasses with case brasilia/ 1.75,Medicine
5910,women 039 s optimum optical womens reading glasses with case floral explosion/ 2.25,Medicine
5911,dcf compression support sleeve knee and calf kinesio green/medium green,Medicine
5912,cuttingedgebargains inc new smart snore stopper device anti snore wrist band cessation sleeping aids blue n/a n/a,Medicine
5913,optimum optical unisex reading glasses northwoods/ 2.25,Medicine
5914,optimum optical unisex reading glasses emerson soft black/ 2.25 black,Medicine
5915,dcf unisex knee recovery and support brace medium/gray 2 pack red/gray,Medicine
5916,women 039 s optimum optical womens reading glasses with case intelligraphic/ 2.25,Medicine
5917,1 voice sleep headphones eye mask black,Medicine
5918,cutting edge bargains knee high graduated compression socks for women and men 6 packs l/xl black,Medicine
5919,women 039 s optimum optical womens reading glasses with case vagabond/ 1.75,Medicine
5920,optimum optical optispex magnifier turquoise/1 pack blue,Medicine
5921,pch life reusable hot and cold therapy face mask purple,Medicine
5922,bluestone heat therapy mittens blue,Medicine
5923,thermoskin orthozone arthritic gloves beige gloves/large white,Medicine
5924,thermoskin fxt ankle compression socks xl,Medicine
5925,extreme fit xtf compression sleeves for knee support 2 pack beige,Medicine
5926,women 039 s optimum optical womens glasses the groove/ 2.50,Medicine
5927,pair of leg compression sleeve unisex sports thigh knee braces yellow meduim,Medicine
5928,bluestone elevated support cushion for leg knee back hip and joint pain,Medicine
5929,men 039 s extreme fit men 039 s compression and body support undershirt navy/large,Medicine
5930,hermell body pillow for back and neck pain relief body pillow,Medicine
5931,men 039 s qpower new men 039 s compression waist wrap slimming effect l black,Medicine
5932,extreme fit hot or cold migraine relief wrap,Medicine
5933,optimum optical unisex reading glasses emerson soft black/ 1.50 black,Medicine
5934,alexorthopedic wood cane with fritz handle and collar black stain,Medicine
5935,women 039 s optimum optical womens glasses opening act/ 3.00,Medicine
5936,thermoskin foot therapy collection crew compression socks/medium,Medicine
5937,bactrack trace pro breathalyzer,Medicine
5938,women 039 s optimum optical womens reading glasses with case boca/ 1.50,Medicine
5939,men 039 s optimum optical mens reading glasses glenbrook/ 2.25,Medicine
5940,dcf compression support sleeve knee black/small black,Medicine
5941,optimum optical optispex magnifier amber/1 pack,Medicine
5942,thermoskin sport knee stabilizer large xl,Medicine
5943,men 039 s extreme fit men 039 s compression and body support undershirt white/2xl,Medicine
5944,men 039 s optimum optical mens reading glasses bristol/ 3.00,Medicine
5945,thermoskin orthozone arthritic gloves black full finger/medium,Medicine
5946,orig3n dna test kit behavior,Medicine
5947,cp core products wrist brace or wrap reflex brace left/xl red,Medicine
5948,qpower certified anti snore relief face wraps pink blue,Medicine
5949,dcf compression support sleeve knee red/large red,Medicine
5950,dcf knee compression energizing sleeve blue/medium,Medicine
5951,as seen on tv copper aid compression ankle sleeve 2 pack small brown,Medicine
5952,extreme fit unisex compression knee support gel sleeve orange medium athletic,Medicine
5953,cuttingedgebargains inc new thigh high arch support compression socks firm thigh support stockings teal l/xl purple,Medicine
5954,women 039 s surecure womens posture corrector with breathable silky weave black small/medium black,Medicine
5955,santamedical generation 2 oled fingertip pulse oximeter silver sm 1100s silver new,Medicine
5956,pure wellness self heating therapy elbow support black large,Medicine
5957,dcf knee compression energizing sleeve red/small,Medicine
5958,cp core products support braces fitted male rib belt/xl,Medicine
5959,extreme fit unisex compression socks for plantar fascilitis 3 pairs blue/large xl blue,Medicine
5960,optimum optical optispex magnifier marble/1 pack,Medicine
5961,cuttingedgebargains inc new thigh high arch support compression socks firm thigh support stockings s/m navy white,Medicine
5962,women 039 s optimum optical womens reading glasses with case luminous/ 2.50,Medicine
