,item_name,category
8033,canarm belt drive downblast spun aluminum exhauster 16.5 inch 1 1/2 hp 3 phase model alx165dbt30150m,Fans
8034,tjernlund underaire crawl space ventilator economy one crawl space fan 110 cfm model v1,Fans
8035,canarm wall exhaust fan 12 inch 2 speed 1/4 hp model s12 e2,Fans
8036,cool attic belt drive whole house fan 36 inch 9 700 cfm model cx36bd2spd white,Fans
8037,tpi industrial drum fan 36 inch 1/2 hp 14 500 cfm model pb 36 b,Fans
8038,medique eyewash station two 32 oz. bottles model 4127,Fans
8039,multifan turbo 36 inch stir fan 1/2 hp 12 000 cfm 460 volt 3 phase model turbo36/3ph,Fans
8040,tpi th series mul t mountindoor/outdoor quartz infrared heater 17 065 btu 480 volts galvanized steel model 342 60 th 480v brown,Fans
8041,patterson chain suspended fan 14 inch model h14b cs,Fans
8042,schaefer fiberglass exhaust fan 48 inch 22 365 cfm 115/230 volts model ffm485g1,Fans
8043,schaefer washdown duty circulation fan 30 inch 10 141 cfm 1/2 hp 115 volt model 30cfo ewds,Fans
8044,strongway open motor direct drive drum fan 48 inch 2/3 hp 18 900 cfm,Fans
8045,canarm belt drive wall exhaust fan with cabinet 42 inch 3/4 hp 14 800 cfm single phase model xbl42cbs10075,Fans
8046,tpi industrial direct drive suspension blower 42 inch 1/2 hp 16 200 cfm model sb 42 d,Fans
8047,schaefer tiltable mobile drum fan 36 inch 11 000 cfm 1/2 hp model vkt36 black,Fans
8048,cool attic power roof vent 1 400 cfm black finish model cx3000eeambl,Fans
8049,cool attic power roof vent 1 400 cfm mill finish model cx3000eeamups,Fans
8050,j d mfg. typhoon exhaust fan 30 inch 7 600 cfm no cone model vns30s850,Fans
8051,schaefer mobile box fan 48 inch 14 100 cfm 1 hp model mob4851 2,Fans
8052,vostermans multifan exhaust 20 inch system 4 fan 240 volt model s4204e2i,Fans
8053,j d mfg. barnstormer recirculation fan 9 880 cfm 36 inch diameter blade 1/2 hp 230 volt model vbs36a white,Fans
8054,schaefer exhaust fan 12 inch 1 604 cfm 1/3 hp 115/230 volt model pfm126p13 white,Fans
8055,canarm explosion proof totally enclosed exhaust fan 24 inch 1/3 hp 5 500 cfm model sd24 xpf,Fans
8056,three speed oscillating tower fan with remote control metallic silver/black,Fans
8057,12 oscillating floor fan w/remote breeze modes 8hr timer,Fans
8058,remote control tower fan five speeds black/silver,Fans
8059,air purifier refill linen scent 3 1/4 x 3/4 x 5 1/2 2/each,Fans
8060,quartz tower heater 13 1/4 w x 10 1/8 d x 23 1/4 h white,Fans
8061,cool mist humidifier with humidistat 2gal 10 15/16w x 17 9/16d x 16 21/32h,Fans
8062,super turbo three speed high performance fan black,Fans
8063,360 surround fan forced heater 9 x 9 x 12 gray,Fans
8064,comfortemp oil filled radiator off white 13 4/5 x 9 1/10 x 25 1/5,Fans
8065,hepa type tower 195 sq ft room capacity black,Fans
8066,turbo ionic air purifier 500 sq ft room capacity three speeds,Fans
8067,quietset 8 speed whole room tower fan 10w x 40h black,Fans
8068,unassembled pedestal fan 30 non oscillating,Fans
8069,quartz tower heater w/two heat settings 14w x 9 3/4d x 24h,Fans
8070,warm mist humidifier black 12 7/10w x 7 1/2d x 12 1/5h,Fans
8071,extended life replacement filter for cool mist humidifier with humidstat,Fans
8072,comfort control tower fan white,Fans
8073,carbon filter for aeramax 190 air purifiers 10 1/8 x 13 3/16 4/pack,Fans
8074,true hepa filter with aerasafe antimicrobial treatment for aeramax 290,Fans
8075,universal pre filter,Fans
8076,air purifier 300 sq ft room capacity hepa filter,Fans
8077,mini tower ceramic heater 7 3/8 w x 7 3/8 d x 17 3/8 h black,Fans
8078,dyna glo indoor kerosene radiant heater 10 000 btu 500 sq. ft. heating capacity model rmc 55r7,Heaters
8079,flagro usa flexible ducting 12 inch diameter x 12ft. model fv hd12 black,Heaters
8080,classic accessories veranda square base standup patio heater cover pebble 34 inch diameter dome x 18 1/2 inch square base x 95 inch h model 71952,Heaters
8081,cadet compak plus electric in wall heater 240v 1 500 watt white model csc152tw,Heaters
8082,cadet electric baseboard heater 240 volt 1 000 watt white model 4f1000w,Heaters
8083,cadet register plus heater box only 120 volt 500/1 000/1 500 watt model rm151,Heaters
8084,flagro usa indirect heater 200 000 btu propane model fvp 200,Heaters
8085,tpi 2 stage low voltage wall thermostat model tw123 white,Heaters
8086,farenheat electric wall heater 6 826 btu 240 volts model ffc2048,Heaters
8087,sunstar heating products infrared ceramic heater ng 120 000 btu model sg12 n,Heaters
8088,tpi thss series mul t mount indoor/outdoor quartz infrared heater 16 382 btu 480 volts stainless steel model 223 60 thss 480v,Heaters
8089,mr. heater vent free natural gas radiant wall heater 30 000 btu 5 plaque model mhvfrd30ngt,Heaters
8090,sunstar heating products infrared ceramic heater ng 52 000 btu model sgm6 n1a,Heaters
8091,flagro usa indirect heater 390 000 btu natural gas model fvn 400,Heaters
8092,briskheat ibc/tote tank heater 240 volts 48 inch h model tote482 adj,Heaters
8093,tpi fan forced electric heater 7 500 watt 25 600 btu model p3p5107ca1n,Heaters
8094,briskheat extra heavy duty metal drum heater 15 gallon capacity 120 volts model dhch11,Heaters
8095,tpi portable dry heat salamander heater 51 195 btu 480 volts model fes 1548 3e yellow,Heaters
8096,fire sense wt living tuscan tile mission style tile rim firepit brown new,Heaters
8097,housewarmer slim profile direct vent heater with blower natural gas 8 000 btu model hwdv081bn,Heaters
8098,cadet electric baseboard heater 540/375 watts 1 705/1 279 btu almond model 2f500a,Heaters
8099,cadet electric baseboard heater 240 volt 1 500 watt white model 6f1500w,Heaters
8100,cadet electric baseboard heater 240 volt 1 250 watt white model 5f1250w,Heaters
8101,tpi overhead infrared quartz heater 16 382 btu 480 volts model 223 30 thss 480v,Heaters
8102,lanair mxd 200 ductable waste oil heater includes heater and thermostat model 9971,Heaters
8103,cadet bi metal thermostat single pole 120/208/240 volt 22 amp almond model t410a white,Heaters
8104,flagro usa indirect heater 390 000 btu diesel model fvo 400,Heaters
8105,king electric garage heater 25 600 btu 7 500 watts model kb2407 1 b2 eco,Heaters
8106,sunstar heating products infrared ceramic heater lp 32 000 btu model sg3 l5b,Heaters
8107,sunstar heating products garage tube heater lp 25 000 btu model sir25 15 l,Heaters
8108,heatstar high output indirect forced air heater propane 765 000 btu model hs9000id,Heaters
8109,lanair waste oil fired thermostat controlled heater ductable package 300 000 btu 10 000 sq. ft. capacity through roof chimney model mxd 300a package a,Heaters
8110,fostoria by tpi portable electric heater 4.5 kilowatts 480 volts 14 972 btus model fsp 4348 3,Heaters
8111,heatstar direct fired forced air heater 250 000 btu 2100 cfm forced air model f109120 white,Heaters
8112,profusion heat electric panel convection heater 1365 btu model ph 08h2,Heaters
8113,profusion heat ceiling mounted workshop heater with halogen light 5 200 btus 1 500 watts model hq1500,Heaters
8114,powerblanket insulated ibc tote heater with digital thermostat 250 gallon capacity 1033 watts 120 volts model th250,Heaters
8115,powerblanket 5 gallon insulated pro drum heater/barrel blanket 160 f adjustable thermostat model bh05 pro,Heaters
8116,tpi overhead flat panel electric infrared heater 4 300 watt 14 672 btu model fss 4320 3,Heaters
8117,tpi fan forced electric heater 10 000 watt 34 100 btu model hf2b5110ca1l,Heaters
8118,cadet compak plus heater box only with thermostat 120 volt 1 000 watt model cs151t,Heaters
8119,mr. heater vent free liquid propane radiant wall heater 18 000 btu 3 plaque model mhvfr20lpt,Heaters
8120,lanair ductable waste oil heater 300 000 btu model mxd300 ductable,Heaters
8121,tpi suspended salamander heater 51 195 btu 480 volt model yes 1548 3e yellow,Heaters
8122,powerblanket hot box pro bulk material warmer with digital thermostat 64 cu. ft. capacity 1440 watts model hb64pro 1440,Heaters
8123,drolet high efficiency eco 65 pellet heater 65 000 btu model dp00060 grey,Heaters
8124,mr. heater vent free natural gas radiant wall heater 20 000 btu 3 plaque model mhvfr20ngt,Heaters
8125,cadet electric baseboard heater 1 500/1 125 watts 5 115/1 125 btu almond model 6f1500a,Heaters
8126,lanair waste oil fired thermostat controlled heater 300 000 btu 10 000 sq. ft. capacity model mx 300,Heaters
8127,mr. heater vent free liquid propane radiant wall heater 30 000 btu 5 plaque model mhvfrd30lpt,Heaters
8128,lanair ductable waste oil heater 300 000 btu model mxd300 ductable,Heaters
8129,profusion heat ceiling/wall mount garage heater 5 000 watts 240 volts 17 065 btus model eh 4609,Heaters
8130,cadet softheat hydronic baseboard heater 750 watt 47 inch w 240 volt white model ebhn750w,Heaters
8131,flagro usa self contained heater trailer 390 000 btu diesel model fvo 400tr,Heaters
8132,cadet electric programmable thermostat 16.7 amp white model th106,Heaters
8133,tpi portable dry heat salamander heater 51 195 btu 240 volts model fes 1520 1a yellow,Heaters
8134,cadet compak twin plus electric in wall heater 240v 3 000 watt white model cstc302tw,Heaters
8135,flagro usa propane construction heater 150 000 btu model f 150t,Heaters
8136,briskheat extra heavy duty metal pail heater 5 gallon capacity 240 volts model dhch20,Heaters
8137,cadet bi metal thermostat double pole 120/208/240 volt 22 amp almond model t410b,Heaters
8138,profusion heat garage heater 15 922 btu 240 volts model eh 4607b,Heaters
8139,sunstar heating products 24 volt thermostat model 30562000,Heaters
8140,tpi suspended salamander heater 102 390 btu 480 volt model yes 3048 3a yellow,Heaters
8141,flagro usa indirect heater 200 000 btu diesel/kerosene model fvo 200,Heaters
8142,briskheat ibc/tote tank heater 120 volts 42 inch h model tote421 adj,Heaters
8143,tpi vertical mounting bracket fits tpi 5100 series 7.5 20 kw heaters model v5120,Heaters
8144,sunstar heating products infrared ceramic heater lp 100 000 btu model sg10 l,Heaters
8145,lanair waste oil fired thermostat controlled heater ductable package 300 000 btu 10 000 sq. ft. capacity through wall chimney model mxd 300b package b,Heaters
8146,dyna glo tank top heater 40 000 btu model tt360dg,Heaters
8147,homcomfort patio heater with wicker stand 50 000 btu propane stainless steel model hcphsswkr,Heaters
8148,tpi portable dry heat salamander heater 51 195 btu 208 volts model fes 1520 3a yellow,Heaters
8149,drolet heatmax ii high efficiency add on furnace 310 000 btu epa certified model df1001,Heaters
8150,mr. heater propane vent free blue flame wall heater 20 000 btu model mhvfb20lpt,Heaters
8151,lanair ductable waste oil heater 300 000 btu model mxd300 ductable,Heaters
8152,flagro usa dual fuel construction heater 1 500 000 btu model f 1500t black,Heaters
8153,united states stove company flue adapter for ef 1600 furnace and metal fab products model sdv6 gray,Heaters
8154,tpi overhead flat panel electric infrared heater 9 500 watt 32 415 btu model fss 9524 3,Heaters
8155,cadet compak plus heater box only without thermostat 240 volt 1 500 watt model cs152,Heaters
8156,duravent vent unit heater kit 3 inch vertical model 0370 gray,Heaters
8157,lanair waste oil fired thermostat controlled heater package 300 000 btu 10 000 sq. ft. capacity through roof chimney model mx 300a package a,Heaters
8158,tpi in wall vent heater 2 560 btu 750 watts white model e4375trpw,Heaters
8159,vestil portable infrared heater 3 000 watts height adjustable model heat s2 yellow,Heaters
8160,tpi th series mul t mount electric quartz infrared heater 10 922 btu 240 volts galvanized steel model 222 60 th 240v,Heaters
8161,tpi fan forced electric heater 15 000 watt 51 200 btu model p3p5115ca1n,Heaters
8162,mr. heater liquid propane convection heater 25 000 btu model mh25cvx,Heaters
8163,sunstar heating products infrared ceramic heater ng 140 000 btu model sg14 n,Heaters
8164,cadet softheat hydronic baseboard heater 500 watt 35 inch w 240 volt white model ebhn500w,Heaters
8165,sunstar heating products infrared ceramic heater ng 100 000 btu model sg10 n,Heaters
8166,tpi suspended salamander heater 51 195 btu 208 volt model yes 1520 3a yellow,Heaters
8167,homcomfort square pyramid outdoor propane heater 42 000 btu stainless steel finish model hcphssq,Heaters
8168,mr. heater vent free blue flame garage/workshop wall heater natural gas 30 000 btu model mhvfg30tb ng,Heaters
8169,modernhome touch activated digital space heaters with built in thermostat white,Heaters
8170,profusion heat wall mount/freestanding convection heater with thermostat 5 100 btu model hc19 15e2,Heaters
8171,tpi vertical mounting bracket fits tpi 5100 series 3.3 5 kw heaters model v5105,Heaters
8172,powerblanket insulated ibc tote heater with digital thermostat 350 gallon capacity 1440 watts 120 volts model th350,Heaters
8173,mr. heater propane gas gauge model f276342,Heaters
8174,sunstar heating products infrared ceramic heater ng 26 000 btu model sgm3 n1,Heaters
8175,lanair waste oil fired thermostat controlled heater package 200 000 btu 5 000 sq. ft. capacity through wall chimney model mx 200b package b,Heaters
8176,tpi thss series mul t mount indoor/outdoor quartz infrared heater 25 298 btu 240 volts stainless steel model 343 60 thss 240v,Heaters
8177,warmguard drum band heater 30 gallon capacity model wg30,Heaters
8178,cuttingedgebargains inc new portable mini car humidifier 3 in 1 air freshener aromatherapy diffuser pink new,Humidifiers
8179,ultrasonic aroma diffuser and humidifier with essential oil white,Humidifiers
8180,pure enrichment ultrasonic cool mist humidifier with variable mist control,Humidifiers
8181,crane droplet ultrasonic cool mist humidifier blue,Humidifiers
8182,crane droplet ultrasonic cool mist humidifier white,Humidifiers
8183,bell howell sonic breathe ultrasonic personal humidifier white,Humidifiers
8184,vitagoods aroma1 diffuser and humidifier with 7 led light settings and color choices,Humidifiers
8185,ecogecko little squirt air revitalizer diffuser silver,Humidifiers
8186,zaq sky aroma essential oil starry projection diffuser white,Humidifiers
8187,the black series black series ultrasonic travel humidifier,Humidifiers
8188,canary products portable humidifier with blue led light new blue/light,Humidifiers
8189,led ultrasonic air humidifier and aroma diffuser,Humidifiers
8190,zaq sky aroma essential oil starry projection diffuser yellow,Humidifiers
8191,ecogecko little squirt air revitalizer diffuser black,Humidifiers
8192,serenelife ultrasonic humidifier cool mist moisture w/ aroma/oil fragrance diffuser 2.5 l white no new,Humidifiers
8193,qpower premium new car humidifier purple,Humidifiers
8194,gurin steam inhaler and mask,Humidifiers
8195,greenair portable usb ultrasonic diffuser 1 each,Humidifiers
8196,ultrasonic cool mist humidifier aroma diffuser light,Humidifiers
8197,ultrasonic color changing cool mist bulb humidifier multi color new usb charge,Humidifiers
8198,ecogecko ultrasonic essential oil diffuser and cool mist humidifier,Humidifiers
8199,healthsmart cube mate cool mist ultrasonic humidifier and aromatherapy diffuser,Humidifiers
8200,crane warm cool mist humidifier white,Humidifiers
8201,bell howell sonic breathe ultrasonic personal humidifier red,Humidifiers
8202,healthsmart mist xp ultrasonic cool mist humidifier new white/blue,Humidifiers
8203,order home collection portable humidifier blue new,Humidifiers
8204,health rite tgh 01 high position ultrasonic humidifier white new,Humidifiers
8205,crane personal compact heaters black,Humidifiers
8206,us jaclean aroma globe diffuser with oils red/blue/yellow,Humidifiers
8207,qpower premium new car humidifier blue,Humidifiers
8208,serenelife ultrasonic humidifier cool mist moisture allergy relief quiet operation 2.5l multi color 5 foot power cord included,Humidifiers
8209,friyah ultrasonic aroma diffuser and humidifier cube,Humidifiers
8210,bell howell ultrasonic color changing cool mist humidifier multi color new,Humidifiers
8211,qpower premium new car humidifier green,Humidifiers
8212,north point ultrasonic led air humidifier diffuser with 7 color changing light red/light,Humidifiers
8213,healthsmart mist xp cool mist ultrasonic humidifier,Humidifiers
8214,imountek 7 color led ultrasonic air humidifier and aroma diffuser white,Humidifiers
8215,bell howell sonic breathe ultrasonic personal humidifier pink,Humidifiers
8216,canary products glass and bamboo aroma diffuser,Humidifiers
8217,ecogecko color wheel air cleaner humidifier diffuser blue/gray/light/natural,Humidifiers
8218,imountek 177ml ultrasonic aroma diffuser with led lime green,Humidifiers
8219,ultrasonic aroma diffuser and humidifier with essential oil black,Humidifiers
8220,serenelife cool mist ultrasonic humidifier moisture allergy relief quiet operation 4.1l white power cord length 5.0 039 feet new,Humidifiers
8221,pyle ultrasonic humidifier warm/cool mist moisture with built in night light new,Humidifiers
8222,zaq sky aroma essential oil starry projection diffuser pink,Humidifiers
8223,imountek colorful led pyramid ultrasonic aroma diffuser white,Humidifiers
8224,sierra modern home inspure modern ultrasonic humidifer w/ aromatherapy mist remote control walnut wood none,Humidifiers
8225,ecogecko color wheel air cleaner and humidifier gray,Humidifiers
8226,zaq sky aroma essential oil starry projection diffuser blue,Humidifiers
8227,zaq sky aroma essential oil starry projection diffuser black,Humidifiers
8228,pure enrichment premium ultrasonic cool mist humidifier,Humidifiers
8229,objecto h5 humidifier with led night light and aromatherapy white,Humidifiers
8230,ledsniper 100ml essential oil diffuser cool mist aroma humidifier,Humidifiers
8231,crane classic warm mist humidifier grey new,Humidifiers
8232,healthsmart quiet bubble mist cool ultrasonic humidifier new,Humidifiers
8233,bell howell sonic breathe ultrasonic personal humidifier purple,Humidifiers
8234,ae ultrasonic cool mist humidifier aroma oil diffuser,Humidifiers
8235,mizu ultrasonic aroma diffuser/humidifier,Humidifiers
8236,serene life serene life cool mist ultrasonic humidifier,Humidifiers
8237,crane droplet ultrasonic cool mist humidifier grey,Humidifiers
8238,greenair spa vapor diffuser 1 each,Humidifiers
8239,ecogecko glowing water air washer and revitalizer,Humidifiers
8240,crane ee5301o,Humidifiers
8241,ashley hearth products hearth pad kit 48 inch type 2 volcanic sand brown model hs48vs,Stoves & Fireplaces
8242,pleasant hearth fenwick fireplace glass door bronze for 36 inch 43 inch w x 25.5 inch to 32.5 inch h openings model fn 5702,Stoves & Fireplaces
8243,united states stove company bay front pellet stove 48 000 btu model 5660,Stoves & Fireplaces
8244,pleasant hearth edinburg fireplace glass door for masonry fireplaces medium gunmetal model ed 5411,Stoves & Fireplaces
8245,meeco 039 s red devil multifuel lighting pellets case of 12 model 417c,Stoves & Fireplaces
8246,classic accessories veranda 71942 fire pit cover square,Stoves & Fireplaces
8247,logwood cast iron logwood stove 54 000 btu epa certified model 1269e,Stoves & Fireplaces
8248,profusion heat infrared fireplace with real flame effect 5 180 btu model fp404r q brown,Stoves & Fireplaces
8249,vogelzang high efficiency wood stove with blower 68 000 btu model vg150,Stoves & Fireplaces
8250,classic accessories veranda standup fire pit cover pebble 33 1/2 inch l x 35 1/2 inch w x 35 inch h model 72952,Stoves & Fireplaces
8251,meeco 039 s red devil gel firestarter case of 12,Stoves & Fireplaces
8252,vogelzang heavy duty log cart model lc 37,Stoves & Fireplaces
8253,landmann usa steel fire pit 23 1/2 inch diameter sarasota design black color model 26384,Stoves & Fireplaces
8254,pleasant hearth vent free fireplace 32 000 btu 46 inch natural gas heritage finish model vff ph32ng h1,Stoves & Fireplaces
8255,united states stove company hot blast wood furnace 120 000 btu epa certified model 1330e,Stoves & Fireplaces
8256,bayou classic fire starter off white,Stoves & Fireplaces
8257,profusion heat electric fireplace with 3 color flame 5 180 btu model fp405r qa,Stoves & Fireplaces
8258,pleasant hearth southern oak brown vent free gas log set 30 000 btu 18 inch model vfl so18dt,Stoves & Fireplaces
8259,pleasant hearth arrington fireplace glass door for masonry fireplaces large black/gold finish model ar 1022,Stoves & Fireplaces
8260,pleasant hearth enfield fireplace glass door for masonry fireplaces large burnished bronze model en 5502,Stoves & Fireplaces
8261,mystical fire variety deal 12 pack,Stoves & Fireplaces
8262,pleasant hearth vent free fireplace 32 000 btu 46 inch propane cherry finish model vff ph32lp 2c2,Stoves & Fireplaces
8263,pleasant hearth carlisle fireplace glass door for masonry fireplaces small black model cl 3000,Stoves & Fireplaces
8264,pleasant hearth carlisle fireplace glass door for masonry fireplaces large black model cl 3002,Stoves & Fireplaces
8265,classic accessories log rack cover black fits 4ft. log rack model 52 068 020401 00,Stoves & Fireplaces
8266,pleasant hearth grandior fireplace glass door for masonry fireplaces medium antique brass model gr 7201,Stoves & Fireplaces
8267,pleasant hearth ascot fireplace glass door for masonry fireplaces medium black model at 1001,Stoves & Fireplaces
8268,chevron brass fireplace screen,Stoves & Fireplaces
8269,hickory heavy duty fire pit cover fits small 44 inch diameter tan small hickory/antique oak/mahogany brown,Stoves & Fireplaces
8270,united states stove company universal combustion blower model 80473,Stoves & Fireplaces
8271,mystical fire variety deal 50 pack,Stoves & Fireplaces
8272,stonegate designs fir log firewood rack 1/8 cord capacity 3ft.l,Stoves & Fireplaces
8273,pelpro pellet stove 35 000 btu model pp60,Stoves & Fireplaces
8274,pleasant hearth vent free fireplace 27 500 btu 42 inch propane heritage finish model vff ph26lp 2h2,Stoves & Fireplaces
8275,pleasant hearth vent free fireplace 27 500 btu 42 inch natural gas cherry finish model vff ph26ng,Stoves & Fireplaces
8276,ashley hearth products insert surround kit model ag34ik black,Stoves & Fireplaces
8277,pleasant hearth colby fireplace glass door for masonry fireplaces small sunlight nickel model cb 3300,Stoves & Fireplaces
8278,pleasant hearth cahill fireplace glass door for masonry fireplaces medium antique bronze model ca 3201,Stoves & Fireplaces
8279,ashley hearth products hearth pad standard 60 inch x 60 inch safari sand brown model hs60ss,Stoves & Fireplaces
8280,pleasant hearth liquid propane conversion kit works with pleasant hearth vented gas log set model spk100,Stoves & Fireplaces
8281,pleasant hearth cahill fireplace glass door for masonry fireplaces large antique bronze model ca 3202,Stoves & Fireplaces
8282,pleasant hearth edinburg fireplace glass door for masonry fireplaces large gunmetal model ed 5412,Stoves & Fireplaces
8283,the northwest company stainless steel electric fireplace w/ wall mount and floor stand remote 36 36 electric stainless steel new metallic,Stoves & Fireplaces
8284,pure garden fireplace log rack or bin log bin with scrolls black,Stoves & Fireplaces
8285,classic accessories full coverage fire pit cover square black 42 l x 42 d x 22 h,Stoves & Fireplaces
8286,pewter fireplace tools,Stoves & Fireplaces
8287,pleasant hearth ascot fireplace glass door for masonry fireplaces small black model at 1000,Stoves & Fireplaces
8288,pelpro hopper extension 200 lb. capacity fits pelpro pp130 pellet stove model pphe200,Stoves & Fireplaces
8289,landmann ember retainer fireplace grate 18 inch w 5 bars model 9718s5,Stoves & Fireplaces
8290,landmann steel fireplace grate 27 inch w 6 bars model 88276,Stoves & Fireplaces
8291,woodpro wood stove 115 000 btu epa certified model ws ts 2500 grey,Stoves & Fireplaces
8292,pleasant hearth vent free fireplace 27 500 btu 42 inch natural gas tobacco finish model vff ph26ng t1,Stoves & Fireplaces
8293,ashley hearth products vent free stove 31 000 btu natural gas black model agc500vfbn,Stoves & Fireplaces
8294,england stove works pellet stove 42 000 btu epa certified model 55 shp10,Stoves & Fireplaces
8295,drolet heatpro add on wood furnace 421 000 btu epa certified model df03000,Stoves & Fireplaces
8296,pleasant hearth grandior fireplace glass door for masonry fireplaces large antique brass model gr 7202,Stoves & Fireplaces
8297,2x4 basics firewood rack bracket kit model 90142mi,Stoves & Fireplaces
8298,ironton log carrier and stand 41 1/2 inch l firewood,Stoves & Fireplaces
8299,drolet black stag high efficiency wood stove 90 000 btu epa certified model db03410,Stoves & Fireplaces
8300,corbett silver fireplace screen,Stoves & Fireplaces
8301,pleasant hearth carlisle fireplace glass door for masonry fireplaces medium black model cl 3001,Stoves & Fireplaces
8302,pleasant hearth easton fireplace glass door for masonry fireplaces medium midnight black model ea 5011,Stoves & Fireplaces
8303,ashley hearth products vent free stove 31 000 btu natural gas red model agc500vfrn,Stoves & Fireplaces
8304,pleasant hearth vent free fireplace blower model gfb100,Stoves & Fireplaces
8305,lana fireplace screen,Stoves & Fireplaces
8306,drolet escape 1400 i wood insert trio 60 000 btu epa certified includes faceplate and venting kit model db03122k,Stoves & Fireplaces
8307,ashley bayfront wood burning insert deluxe kit 79 000 btu model aw180d,Stoves & Fireplaces
8308,mystical fire variety deal 25 pack,Stoves & Fireplaces
8309,roughneck covered firewood rack 4ft.l model 90350,Stoves & Fireplaces
8310,furinno outdoor squre fire pit bronzed black fpt17121 black new,Stoves & Fireplaces
8311,classic accessories full coverage fire pit cover round black 42 dia x 22 h,Stoves & Fireplaces
8312,miracle heat stove and furnace heat reclaimer fits 6 inch flue model mhd6,Stoves & Fireplaces
8313,landmann northwood outdoor fireplace 26 inch h black model 28405,Stoves & Fireplaces
8314,pleasant hearth alpine fireplace glass door for masonry fireplaces medium black model an 1011,Stoves & Fireplaces
