,item_name,category
2832,aicase diamond hybrid shockproof protective case for iphone 7/8 7 plus/8 plus purple black iphone 7 plus 66302801,Cell Phones Accessories
2833,waloo zernix series protective case iphone 6 plus and 6s plus/pink 61100509,Cell Phones Accessories
2834,alcase folio wallet case stand for iphone 7/7 plus galaxy s8/s8 plus/s7 edge rose gold samsung galaxy s8 plus 58093395,Cell Phones Accessories
2835,aduro shatterguardz body tempered glass screen protector samsung galaxy s5/black shgfc gs5 01,Cell Phones Accessories
2836,walvodesign glitter liquid sparkle quicksand case silver s7 pco s7 lqsnd sl,Cell Phones Accessories
2837,iphone 6s 4.7 leather pouch fds77 colored blue other ph wpiphone6fds77cblue,Cell Phones Accessories
2838,ultra slim hard case cover for iphone 6 6s 7 plus tempered glass gold for iphone 6s plus 67286263,Cell Phones Accessories
2839,bingstechbox iphone 6 6s and 6s plus completely enclosing slim waterproof case pink for iphone 6s plus 61209215,Cell Phones Accessories
2840,fabrique nfl team pride glow bright led projector light carolina panthers light/dark,Cell Phones Accessories
2841,walvo design sparkle 3 in 1 anti slick tpu case samsung s8/silver cssams8 udz sl,Cell Phones Accessories
2842,walvodesign cute flowing liquid glitter case iphone 6/7/8 and plus samsung note 8/8 plus iphone 8 plus spring blossom ftcip7l watf sbs pink,Cell Phones Accessories
2843,dreamwireless trndy wallet case for iphone 6 ice cream lpfip6s trndy icd yellow,Cell Phones Accessories
2844,walvodesign watercolor style cases samsung s7 edge/peach blossom tisams7eg wcs pbs blue,Cell Phones Accessories
2845,bingstechbox iphone 8 and 8 plus completely enclosing slim waterproof case clear for iphone 8 plus 69576439,Cell Phones Accessories
2846,pink box stainless steel sassy themed interchangeable pop up phone holder mount silver attitude popup attitude,Cell Phones Accessories
2847,aicase 3 in 1 defender case for iphone x 7/8 7 plus/8 plus 6s 6/6s plus 5/5s dark purple/pink iphone 6 plus 6s plus 72683219,Cell Phones Accessories
2848,walvodesign anti scratch acrylic rear cover tpu bumper case for iphone and samsung models black iphone 7 iphone 8 ftcip8l acl bkcl,Cell Phones Accessories
2849,aicase waterproof shockproof full case fr iphone 7/8 or 7 plus/8 plus black black iphone 8 66823611,Cell Phones Accessories
2850,fortem protective shockproof hybrid case cover for apple iphone 7 8 plus purple teal iphone 7 plus 55514011,Cell Phones Accessories
2851,unicorn durable case for iphone 7/8 7/8 plus and iphone x babycorne iphone 7 plus 74619237,Cell Phones Accessories
2852,insten clear tempered glass lcd screen protector film for apple iphone x iphone x rose gold 2394010,Cell Phones Accessories
2853,insten chrome spot diamond bling hard snap on case cover for apple iphone 5/5s blue apple iphone 5/5s 2348158,Cell Phones Accessories
2854,samsung galaxy s9 plus trndy leather flip wallet case white other p lpfsams9l trndy htc,Cell Phones Accessories
2855,bingstechbox iphone 6 6s and 6s plus completely enclosing slim waterproof case white for iphone 6 plus 61209235,Cell Phones Accessories
2856,lax gadgets clear case for iphone 8/7 8 plus/7 plus with tempered glass clear 2 pack iphone 8 2xclearcasei8 clear temp,Cell Phones Accessories
2857,walvodesign cute flowing liquid glitter case iphone 6/7/8 and plus samsung note 8/8 plus iphone 8 tropical summer ftcip7 watf tps green,Cell Phones Accessories
2858,ghostek covert2 case for iphone 7/8 iphone 7/8 plus and iphone x red iphone 8 plus and iphone 7 plus ghocas785,Cell Phones Accessories
2859,aicase 3 in 1 slim protective case for samsung galaxy note 8 s8/s8 plus s7 black samsung galaxy s8 66137115,Cell Phones Accessories
2860,area dualpro by incipio phone case pink/hybrid cover iphone 6 6s plus ar iph 011 pkgy,Cell Phones Accessories
2861,authentic richbox ip68 life waterproof case iphone 7 or iphone 6s plus black iphone 6 6s 55828555,Cell Phones Accessories
2862,trident case trident cyclops apple iphone 6 case grey cy api647 gy000,Cell Phones Accessories
2863,otm essentials iphone 8/7 modern clear printed phone case iphone 8/7 kiss me i 039 m irish op qq a01 44,Cell Phones Accessories
2864,plantronics s12,Phones & Faxes
2865,plantronics cs510,Phones & Faxes
2866,plantronics w720,Phones & Faxes
2867,s3 plus bluetooth headphone fitness tracker,Smartwatches
2868,lenovo hx03,Smartwatches
2869,no.1 f6 android smartwatch silver,Smartwatches
2870,bluetooth fitness tracker,Smartwatches
2871,k1 fitness tracker bracelet black,Smartwatches
2872,dm18 smart watch red,Smartwatches
2873,sports tracker bracelet bv22s,Smartwatches
2874,fitness tracker bracelet blue,Smartwatches
2875,fitness tracker bracelet black,Smartwatches
2876,no.1 f3 sports watch blue,Smartwatches
2877,no.1 f5 bluetooth watch grey,Smartwatches
2878,dm360 smart watch black,Smartwatches
2879,fitness tracker lenovo hx03,Smartwatches
2880,h3 smart strap,Smartwatches
2881,foxwear f28 bluetooth watch,Smartwatches
2882,domino dm68 bluetooth smart bracelet red,Smartwatches
2883,mgcool band 4 fitness tracker bracelet,Smartwatches
2884,allcall w1 smart watch phone silver,Smartwatches
2885,dm360 smart watch silver,Smartwatches
2886,no.1 f3 sports watch red,Smartwatches
2887,dm18 smart watch grey,Smartwatches
2888,dm98 watch phone black,Smartwatches
2889,bluetooth watch foxwear,Smartwatches
2890,fitness tracker bracelet red,Smartwatches
2891,h3 smart strap black,Smartwatches
2892,domino dm68 bluetooth smart bracelet black,Smartwatches
2893,bluetooth fitness tracker bracelet,Smartwatches
2894,heart rate monitor watch w/ chest belt,Smartwatches
2895,zgpax s8 android 4.4 watch phone black,Smartwatches
2896,bluetooth sports tracking watch red,Smartwatches
2897,dm360 smart watch gold,Smartwatches
2898,no.1 f6 bluetooth smartwatch black,Smartwatches
2899,domino dm08 bluetooth watch black,Smartwatches
2900,allcall w1 smart watch phone grey,Smartwatches
2901,h1 smart sports watch,Smartwatches
2902,lenovo hw02 fitness tracker bracelet black,Smartwatches
2903,bluetooth fitness tracker,Smartwatches
2904,sports tracker bracelet gt101 blue,Smartwatches
2905,sports tracker bracelet blue,Smartwatches
2906,dm98 watch phone silver,Smartwatches
2907,i4 air smart watch phone,Smartwatches
2908,no.1 f2 outdoor bluetooth watch green,Smartwatches
2909,sports tracker bracelet black,Smartwatches
2910,unik 2 bluetooth watch black,Smartwatches
2911,sports tracker bracelet gt101 red,Smartwatches
2912,h2 fitness tracker bracelet,Smartwatches
2913,bluetooth watch black,Smartwatches
2914,ordro cf007 bluetooth watch yellow,Smartwatches
2915,dm09 plus smart watch phone gray white,Smartwatches
2916,foxwear fox8 outdoor watch,Smartwatches
2917,ordro s11 smart sports wristband black,Smartwatches
2918,bluetooth smart watch,Smartwatches
2919,sports tracker bracelet gt101,Smartwatches
2920,ordro s11 smart sports wristband blue,Smartwatches
2921,no.1 g5 smart watch black,Smartwatches
2922,no.1 g8 phone watch,Smartwatches
2923,dm09 plus smart watch phone yellow black,Smartwatches
2924,bluetooth sports watch black,Smartwatches
2925,fitness tracker lenovo hw01,Smartwatches
2926,dm09 plus smart watch phone,Smartwatches
2927,ordro s10 smart sport bracelet silver,Smartwatches
2928,led gadget,Smartwatches
2929,iessentials dual usb 2.4a 10w wall charger with 30 pin cable chevron 30pinchevron kit,Cables & Adapters
2930,scosche charge sync cable w/ led indicator for lightning or micro usb devices 3 ft white other 1 pack micro usb 74008083,Cables & Adapters
2931,refurbished apple ipads w/apple mfi certified cable and power adapter refurbished b grade 32gb 10 inches appc4dw/m a1475 black,Cables & Adapters
2932,overtime micro usb charging cable 6ft or 10ft 1 and 2 pack 1 10 black micro usb universal otdcmi10,Cables & Adapters
2933,xtreme cables multi port 6 usb desktop charge tower 1 black single xws8 0113 blk,Cables & Adapters
2934,cablestogo c2g 10ft usb 3.1 gen 1 usb type c to usb b cable m/m usb c cable black usb c cable 10 ft 28867,Cables & Adapters
2935,belkin components 4 pin usb male/female pro series usb extension cable 3 ft f3u134b03,Cables & Adapters
2936,cablestogo c2g 75ft active high speed hdmi cable in wall cl3 rated hdmi cable hdmi m to hdmi m 75 ft black 41368,Cables & Adapters
2937,dell networking omnipath cable qsfp28 to qsfp28 active optical optics included 15 meter customer kit xnj42,Cables & Adapters
2938,iogear 4 port dvi kvmp switch with audio and cables gcs1104,Cables & Adapters
2939,billboard nylon braided usb c sync charge cables 3 6 or 10 ft gold other 6 ft. 3 pack bb356 3,Cables & Adapters
2940,monster mounts monster tilt mount set for 42 75 tvs with hdmi cable mt643,Cables & Adapters
2941,apple iphone with cable and adapter refurbished b grade iphone 6 128gb/gold mg6f2ll/a,Cables & Adapters
2942,gforce tv clip mount for apple tv/ roku 1 media mount cables adapters connectors gf p1124 1222 black,Cables & Adapters
2943,billboard nylon braided micro usb sync charge cables 3 or 6 ft black 3 ft. other 3 pack bb264 3,Cables & Adapters
2944,iessentials dual usb 2.4a 10w wall charger with 30 pin cable camouflage 30pincamo kit green,Cables & Adapters
2945,refurbished apple ipad 3 wifi only with mfi cable and adapter grade a refurbished 64gb black 9.7 inches ip34g64gbblk r,Cables & Adapters
2946,kmd 10 feet usb charge cable for nintendo wii u grey new 2152371,Cables & Adapters
2947,dell networking cable sfp to sfp 10gbe active optical optics included cable 20 meter customer kit xht77,Cables & Adapters
2948,insten 10 039 hdmi to mini hdmi cable type a to type c m/m 10ft 237064 red/green,Cables & Adapters
2949,lax gadgets micro usb 10 feet cable android charger with free wall adapter gray 71044095,Cables & Adapters
2950,xtreme cables multi port 6 usb desktop charge tower 1 white single xws8 0113 wht,Cables & Adapters
2951,dell networking cable sfp to sfp 10gbe active optical optics included cable 15 meter customer kit 2j7cy,Cables & Adapters
2952,insten nikon uc e6 usb data cable for coolpix s230 s220 p50 d5000 s6000 black 275473,Cables & Adapters
2953,iessentials dual usb 2.4a 10w wall charger with 30 pin cable pink dots 30pinpink kit,Cables & Adapters
2954,refurbished apple ipad 5 wifi only with mfi cable and adapter grade a refurbished black 128gb 9.7 inches led lit ip5128gbgry r,Cables & Adapters
2955,cisco 7900 series ip phone power supply cp pwr cube3,Cables & Adapters
2956,cisco 7200 ac power supply pwr 7200 ac,Cables & Adapters
2957,popsockets multi use expandable and collapsible grip/stand for handheld electronic devices socket born free universal ps 101736,Notebook Accessories
2958,topeakmart cell phone stand desktop tablet pc aluminium alloy,Notebook Accessories
2959,halter mesh metal riser 2 pack with pull out drawer and side compartments black stands cooling pads new 66679731,Notebook Accessories
2960,popsockets multi use expandable and collapsible grip/stand for handheld electronic devices socket ceiling universal ps 101026,Notebook Accessories
2961,simplekey extended compact key holder and keychain organizer 2 12 keys blue interior organization,Notebook Accessories
2962,popsockets multi use expandable and collapsible grip/stand for handheld electronic devices socket universal its pretty ps 800042 black,Notebook Accessories
2963,osp car cooler bag interior organization interior,Notebook Accessories
2964,old world map full desk coverage gaming and office mouse pad black stands cooling pads new 72085471,Notebook Accessories
2965,pink box interchangeable pop up inspirational phone holder in stainless steel silver god has a plan popup godhasaplan,Notebook Accessories
2966,popsockets multi use expandable and collapsible grip/stand for handheld electronic devices socket universal fuchsia diamond ps 101634 pink,Notebook Accessories
2967,aicase 2 in 1 car air vent windshield dash smartphone mount 1 2 or 3 pack black 3 pack 69421007,Notebook Accessories
2968,simplekey extended compact key holder and keychain organizer 2 12 keys gold interior organization,Notebook Accessories
2969,fh group water resistant 4 pockets multi functional oxford trunk organizer fh1122 g red interior organization,Notebook Accessories
2970,dell 65 watt 3 prong ac adapter with 6 ft power cord ny3gt,Notebook Accessories
2971,insten 45w ac charger power adapter for hp chromebook elitebook pavilion probook black other 2313629,Notebook Accessories
2972,pink box interchangeable pop up inspirational phone holder in stainless steel silver serenity prayer popup serenity,Notebook Accessories
2973,popsockets multi use expandable and collapsible grip/stand for handheld electronic devices socket universal silence mandala ps 101466 gold,Notebook Accessories
2974,i essentials rapid car charger and universal mount black,Notebook Accessories
2975,dell primary battery laptop battery 1 x lithium ion 3 cell 42 wh for latitude 7280 7480 0nf0h,Notebook Accessories
2976,insten ac wall power adapter charger for acer travelmate series laptop 425344 black/light,Notebook Accessories
2977,osp hanging back seat car organizer interior organization interior back seat car organizer,Notebook Accessories
2978,pink box stainless steel scripture interchangeable pop up phone holder mount silver john 5 24 popup john5.24,Notebook Accessories
2979,pink box interchangeable pop up inspirational phone holder in stainless steel silver love is patient popup loveispatient,Notebook Accessories
2980,popsockets multi use expandable and collapsible grip/stand for handheld electronic devices nebula socket universal ps 101106 blue,Notebook Accessories
2981,fine life auto products retractable auto sunshades 2 pack black novelty accessories interior,Notebook Accessories
2982,targus drifter slipcase laptop carrying case 15.6 inch gray black tss874,Notebook Accessories
2983,pink box interchangeable pop up inspirational phone holder in stainless steel silver soul sisters popup soulsisters,Notebook Accessories
2984,popsockets multi use expandable and collapsible grip/stand for handheld electronic devices socket universal black diamond ps 101452,Notebook Accessories
2985,fh group water resistant 4 pockets multi functional oxford trunk organizer fh1122 g blue interior organization,Notebook Accessories
2986,maze exclusive 2 pack car catcher side organizer 6 colors blue interior organization interior,Notebook Accessories
2987,popsockets multi use expandable and collapsible grip/stand for handheld electronic devices socket universal peace sky mandala ps 101174,Notebook Accessories
2988,tagco collapsible trunk organizer and cooler 1 pack,Notebook Accessories
2989,the northwest company northwest back seat car mounting bracket for digital tablet interior organization interior,Notebook Accessories
2990,fh group non slip dash mat fh1002 g black interior organization,Notebook Accessories
2991,kenu airframe portable car mount black,Notebook Accessories
2992,pink box stainless steel scripture interchangeable pop up phone holder mount silver ephesians 2 10 popup ephesians2.10,Notebook Accessories
2993,pink box stainless steel scripture interchangeable pop up phone holder mount silver proverbs 3 6 popup proverbs3.6,Notebook Accessories
2994,pink box interchangeable pop up inspirational phone holder in stainless steel silver have courage popup havecourage,Notebook Accessories
2995,gpct blue led universal car interior under dash decorative floor lights 4 piece parts 4 lights mobile accessories new blue/gray,Notebook Accessories
2996,car visor cd holder and organizer grey interior organization,Notebook Accessories
2997,pure auto car humidifier n/a blue,Notebook Accessories
2998,embo 12 aluminum jaw stand for smart phones apple ipad and other tablet other silver ts 105,Notebook Accessories
2999,dell 130 watt ac adapter with 6 ft power cord 1j4mf,Notebook Accessories
3000,kocaso super mini notebook fan cooling pad black stands cooling pads gpct2 black,Notebook Accessories
3001,popsockets multi use expandable and collapsible grip/stand for handheld electronic devices socket universal aztec mandala ps 101253 red,Notebook Accessories
3002,octa llc octa tablettail bridge mounting component flexible arm for tablet obrt 001,Notebook Accessories
3003,women 039 s mckleinusa mcklein leather wheeled non detachable laptop cases 1 black,Notebook Accessories
3004,pink box stainless steel scripture interchangeable pop up phone holder mount silver colossians 3 12 popup colossians3.12,Notebook Accessories
3005,pink box interchangeable pop up inspirational phone holder in stainless steel silver being somewhere popup beingsomewhere,Notebook Accessories
3006,pink box stainless steel scripture interchangeable pop up phone holder mount silver john 14 6 popup john14.6,Notebook Accessories
3007,insten laptop 19v ac wall power adapter charger for toshiba satellite 270074 black/light,Notebook Accessories
3008,car back seat organizer holder with slots for bottles magazines and more dark grey interior organization,Notebook Accessories
3009,qpower happy paws waterproof pet seat cover for backseat black interior organization interior,Notebook Accessories
3010,pink box stainless steel scripture interchangeable pop up phone holder mount silver matthew 28 20 popup matthew28.20,Notebook Accessories
3011,aduro u grip stand for tablets black grey uni tab01 ast 12 black,Notebook Accessories
3012,popsockets multi use expandable and collapsible grip/stand for handheld electronic devices socket universal rosegold diamond ps 101636 metallic,Notebook Accessories
3013,trend matters motorcycle helmet net rope 60 cm/ 2 pack,Notebook Accessories
3014,aicase 2 in 1 car air vent windshield dash smartphone mount 1 2 or 3 pack black 1 pack 69421003,Notebook Accessories
3015,simplekey extended compact key holder and keychain organizer 2 12 keys black interior organization,Notebook Accessories
3016,fh group water resistant 4 pockets multi functional oxford trunk organizer fh1122 g black interior organization,Notebook Accessories
3017,handstands roadster sticky pad dash mount combo pack gray,Notebook Accessories
3018,pink box interchangeable pop up inspirational phone holder in stainless steel silver stay humble popup stayhumble,Notebook Accessories
3019,gpct 2 pack deluxe seat wedge organizer interior organization interior,Notebook Accessories
3020,pure auto car humidifier n/a green,Notebook Accessories
3021,fh group waterproof 6.3 x 8.3 small collapsible car trash can fh1120 g small black interior organization,Notebook Accessories
3022,popsockets multi use expandable and collapsible grip/stand for handheld electronic devices black socket universal ps 101000,Notebook Accessories
3023,popsockets multi use expandable and collapsible grip/stand for handheld electronic devices donut socket universal ps 101257 pink,Notebook Accessories
3024,aicase 2 in 1 car air vent windshield dash smartphone mount 1 2 or 3 pack black 2 pack 69421005,Notebook Accessories
3025,aduro u grip adjustable universal tablet headrest mount black other uni tab01 hdr,Notebook Accessories
3026,simplekey extended compact key holder and keychain organizer 2 12 keys silver interior organization,Notebook Accessories
3027,dell 65 watt 3 prong ac adapter with 3.3 ft power cord y1h45,Notebook Accessories
3028,pure auto car humidifier blue 12v accessories mobile accessories,Notebook Accessories
3029,pink box interchangeable pop up inspirational phone holder in stainless steel silver great love popup greatlove,Notebook Accessories
3030,car visor cd holder and organizer beige interior organization,Notebook Accessories
3031,handstands roadster sticky pad gift set black,Notebook Accessories
3032,60 cm motorcycle helmet net rope 2 pack motorcycles new,Notebook Accessories
3033,pink box interchangeable pop up inspirational phone holder in stainless steel silver i love you forever popup iloveyouforever,Notebook Accessories
3034,pink box stainless steel scripture interchangeable pop up phone holder mount silver galatians 2 20 popup galatians2.20,Notebook Accessories
3035,auto edge reflective insulated foil windshield sunshade screen novelty accessories interior,Notebook Accessories
3036,fh group non slip dash mat fh1002 g gray interior organization grey,Notebook Accessories
3037,fh group waterproof 6.3 x 8.3 small collapsible car trash can fh1120 g small beige interior organization,Notebook Accessories
3038,dell microsoft surface 65w ac power adapter 274t8,Notebook Accessories
3039,vangoddy sleeve for 12.5 13.3 laptops chromebook zenbook xps thinkpad probook yoga blue cases sleeves bags laplea211,Notebook Accessories
3040,allstar car genie compartment holder and catcher 2 pack,Notebook Accessories
3041,women 039 s pink box interchangeable pop up inspirational phone holder in stainless steel silver girlfriends popup girlfriends,Notebook Accessories
3042,auto edge portable mini car garbage can 2 pack interior organization interior,Notebook Accessories
3043,pyle low profile sitting standing laptop computer monitor desk stand black other pdris08,Notebook Accessories
3044,fh group water resistant 4 pockets multi functional oxford trunk organizer fh1122 g gray interior organization grey,Notebook Accessories
3045,popsockets multi use expandable and collapsible grip/stand for handheld electronic devices shark socket universal ps 101793 black,Notebook Accessories
3046,genric car visor glasses sunglasses ticket clip holder,Notebook Accessories
3047,pink box stainless steel scripture interchangeable pop up phone holder mount silver matthew 6 33 popup matthew6.33,Notebook Accessories
3048,costech phone holder heavy duty metal gooseneck longarm fashion flexible stand red 64818911,Notebook Accessories
3049,made2go kurvstand phone and tablet stand 3 pack 83358 black,Notebook Accessories
3050,dell 45 watt 3 prong ac adapter with 3 ft us power cord for select xps inspiron laptops d0kfy,Notebook Accessories
3051,the source force car back seat hanging organizer with cup holder gray,Notebook Accessories
3052,imountek multi functional laptop table stand with built in cooling fan and led black mounts new universal gpct653,Notebook Accessories
3053,popsockets multi use expandable and collapsible grip/stand for handheld electronic devices socket universal blue marble ps 101444,Notebook Accessories
3054,modern living 12 volt heated travel mug 12v accessories mobile accessories interior,Notebook Accessories
3055,dell 240 watt ac adapter with 6 ft power cord 8n2t2,Notebook Accessories
3056,dell 130 watt 3 prong ac adapter with 6 ft power cord 2txj7,Notebook Accessories
3057,dell world traveler bundle with power adapter plus 00001,PDA Accessories
3058,dell portable thunderbolt 3 ssd 500gb and usb slim dvd / rw drive dw316 bundle 00001,PDA Accessories
3059,alienware pro gaming keyboard aw768 alienware advanced gaming mouse aw558 00001,PDA Accessories
3060,dell save 5 c2665dnf toner 4 pack color bundle 1 black 67h2t 1 cyan tw3nn 1 yellow 2k1vc 1 magenta v4tg6 00001,PDA Accessories
3061,dell notebook power bank plus usb c 65wh pw7018lc with adapter 65 watt type c with 1m power cord cus kit 00001,PDA Accessories
3062,dell save 5 c2660dn toner 3 pack color bundle 1 cyan tw3nn 1 yellow 2k1vc 1 magenta v4tg6 00001,PDA Accessories
3063,dell 65 whr 6 cell primary battery for latitude e6540/ e6440/ e6440 atg laptops bcc customer install 00001,PDA Accessories
3064,dell save 5 e525w toner 3 pack color bundle 1 cyan h5wfx 1 yellow g20vw 1 magenta 3581g 00001,PDA Accessories
3065,dell education bundle for latitude 3189 carrying case wireless mouse active pen 00001,PDA Accessories
3066,alienware pro gaming keyboard aw768 alienware elite gaming mouse aw958 00001,PDA Accessories
3067,dell xeon e5 2403 1.80ghz 10m cache 6.4gt/s qpi no turbo 4c 80w max mem 1066mhz customer kit for r320/r420/r520 00001,PDA Accessories
3068,alienware advanced gaming keyboard aw568 alienware advanced gaming mouse aw558 00001,PDA Accessories
3069,dell save 5 c2665dnf toner 3 pack color bundle 1 cyan tw3nn 1 yellow 2k1vc 1 magenta v4tg6 00001,PDA Accessories
3070,dell power companion 12000 mah pw7015m and premier backpack m 00001,PDA Accessories
3071,dell 65 whr 6 cell primary lithium ion battery 00001,PDA Accessories
3072,dell save 5 3110cn toner 4 pack color bundle 1 black pf030 1 cyan pf029 1 yellow nf556 1 magenta rf013 00001,PDA Accessories
3073,dell education classroom learner bundle for chrome 5190 2n1 active emr pen type c mobile adapter da 200 00001,PDA Accessories
3074,dell save 5 c2660dn toner 4 pack color bundle 1 black 67h2t 1 cyan tw3nn 1 yellow 2k1vc 1 magenta v4tg6 00001,PDA Accessories
3075,safco impromptu machine stand black 26 1/4 inch w x 21 inch d x 26 1/2 inch h model 1857bl black,Printer Accessories
3076,canon cli 271xl c cyan original ink tank 0337c001,Printer Accessories
3077,canon pgi 270xl pgbk black original ink tank 0319c001,Printer Accessories
3078,canon lk 62 portable kit printer battery 1 x lithium ion for pixma ip100 ip110 2446b003,Printer Accessories
3079,rubbermaid tilt truck 600 lb. capacity model fg9t1800bla black,Printer Accessories
3080,dell h625cdw/h825cdw/s2825cdn maintenance kit fuser transfer belt assembly roller retard roller 100000 page yield part c36f0 sku 591 bbef chfdj,Printer Accessories
3081,canon cl 246 color ink 8281b001 ink cartridge,Printer Accessories
3082,dell s5840cdn series 550 sheet tray 349fh,Printer Accessories
3083,mayline safco scoot underdesk printer stand black 20 1/4 inch w x 16 1/2 inch d x 14 1/2 inch h model 1855bl,Printer Accessories
3084,canon cli 271bk black original ink tank 0390c001,Printer Accessories
3085,canon pg 240xl extra large black original ink cartridge 5206b001,Printer Accessories
3086,canon cli 271gy gray original ink tank for pixma mg6820 mg7720 ts5020 ts6020 ts8020 ts9020 0394c001,Printer Accessories
3087,canon cli 271xl y yellow original ink tank 0339c001,Printer Accessories
3088,mayline safco multi purpose stand black model 1874bl,Printer Accessories
