,item_name,category
0,evening calm print,Collectibles
1,star wars gallery wrapped and framed art prints canvas multi color 16 x 16 matted black framed,Collectibles
2,trademark fine art banksy matted black framed canvas art prints war black canvas 16 x 20,Collectibles
3,trademark fine art banksy matted black framed canvas art prints white canvas 11 x 14 ghetto for life,Collectibles
4,rawlings mlb retired player autographed baseballs edgar martinez seattle mariners official mlb baseball 113672 red,Collectibles
5,riddell speed mini helmet washington redskins,Collectibles
6,one 36x24 canvas print with shipping included,Collectibles
7,trademark michael tompsett skyline canvas art fresno california 16 x 24,Collectibles
8,trademark fine art dina belenko 039 weekend donuts 039 canvas art 22 x 32 multi color,Collectibles
9,trademark fine art vincent van gogh matted wood framed canvas art prints white canvas 11 x 14 wheatfield with cypresses 1889,Collectibles
10,fhs entertainment nfl pittsburgh steelers memorabilia jack ham custom jersey black,Collectibles
11,mojo licensing mlb soft sided carry on spinner luggage washington nationals,Collectibles
12,trademark fine art vincent van gogh gallery wrapped canvas art prints canvas 24 x 32 lilac bush multi color,Collectibles
13,design art gallery wrapped large hand painted or canvas print wall art canvas unframed 60w x 32h orange,Collectibles
14,trademark fine art landscape and photographic multi panel canvas art sets 5 piece multi color 3.3 039 x 4.8 039 ariane moshayedi 039 foliage,Collectibles
15,artsy canvas gallery wrapped city canvas boston night skyline/48x16 black/white,Collectibles
16,artsy canvas baseball bat city pride skylines on canvas detroit 36x24 canvas red,Collectibles
17,trademark fine art dean russo 039 marilyn monroe ii 039 matted black framed art white 16 x 20,Collectibles
18,trademark fine art vincent van gogh matted wood framed canvas art prints white canvas 11 x 14 sower 1888,Collectibles
19,trademark fine art claire doherty 039 airship patent 1913 white 039 ornate framed art 11 x 14 multi color,Collectibles
20,trademark art colorful metal justice,Collectibles
21,rawlings mlb active player autographed baseballs addison russell chicago cubs official 2016 world series baseball 121889,Collectibles
22,the merrick mint black ruthenium indian head buffalo coin black/yellow,Collectibles
23,trademark fine art wildphotoart 039 elephant 039 canvas art 24 x 24 multi color,Collectibles
24,forever collectibles nfl mini helmet bank houston texans,Collectibles
25,trademark fine art jai johnson 039 salmon hibiscus 1 039 canvas art 18 x 18 multi color,Collectibles
26,fhs entertainment yankees memorabilia goose gossage official mlb baseball 20912 green,Collectibles
27,two 36x24 canvas prints with shipping included,Collectibles
28,trademark michael tompsett skyline canvas art orlando florida 16 x 24,Collectibles
29,artsy canvas college periodic table symbol art canvas 16x16 8x8 university of alabama 8x8 canvas,Collectibles
30,icanvas marc allante art on gallery wrapped canvas two step/18x12 dark,Collectibles
31,artsy canvas touch of color skylines houston 36x24 canvas black/white,Collectibles
32,trademark fine art banksy gallery wrapped canvas art prints canvas nyc love 21 x 28 multi color,Collectibles
33,11 12x8 custom canvases,Collectibles
34,fabness one 16x16 canvas,Collectibles
35,trademark art colorful metal charlie brown custom 002,Collectibles
36,trademark fine art hardibudi 039 painting of nature 039 canvas art canvas 24 x 32 multi color,Collectibles
37,artsy canvas watercolor city skylines posters poster paper minneapolis 36x20 poster,Collectibles
38,icanvas leonid afremov gallery wrapped canvas walk with dog/18x12,Collectibles
39,twelve 8x6 custom canvas prints,Collectibles
40,mojo ncaa carry on spinner luggage virginia,Collectibles
41,rawlings mlb retired player autographed baseballs curt schilling arizona diamondbacks official mlb baseball 2001 ws mvp 101415 red,Collectibles
42,officially licensed nfl collectible money banks pittsburgh steelers molded talking bank,Collectibles
43,printerpix two 16x12 custom photo canvas prints,Collectibles
44,trademark michael tompsett skyline canvas art memphis tennessee 16 x 24,Collectibles
45,trademark fine art kalynsky 039 hands ii 039 canvas art 18 x 24 multi color,Collectibles
46,claude monet fine art prints unframed morning in etretat by claude monet,Collectibles
47,artsy canvas outer space earth from space 48x16,Collectibles
48,forever collectibles nfl mini helmet bank washington redskins,Collectibles
49,trademark fine art philippe hugonnard 039 eiffel tower paris 039 canvas art 35 x 47 multi color,Collectibles
50,four 5x7 premium tabletop canvas prints,Collectibles
51,10 12x8 custom canvases,Collectibles
52,riddell ncaa speed mini helmet north carolina 2015,Collectibles
53,riddell speed mini helmet new orleans saints,Collectibles
54,elementem photography assorted collection photographic prints on wrapped canvas wall art 60x90 autumn forest,Collectibles
55,design art gallery wrapped large hand painted or canvas print wall art canvas unframed 60w x 32h blue,Collectibles
56,design art gallery wrapped large hand painted or canvas print wall art canvas unframed 60w x 28h blue,Collectibles
57,trademark fine art banksy gallery wrapped canvas art prints peace canvas 24 x 32 multi color,Collectibles
58,merrick mint nfl team helmet logo 24k gold plated 1976 ike bicentennial dollar us coin cleveland browns red/yellow,Collectibles
59,trademark michael tompsett skyline canvas art wilmington delaware 16 x 24,Collectibles
60,artsy canvas baseball bat city pride skylines on canvas minneapolis 36x24 canvas red,Collectibles
61,mojo licensing ncaa soft sided carry on spinner luggage east carolina,Collectibles
62,wilson nba and ncaa autographed memorabilia julius erving new jersey nets adidas hardwood classics jersey blue 61809,Collectibles
63,the sports vault nhl mini guitar vancouver canucks,Collectibles
64,artsy canvas outer space shuttle station 48x16,Collectibles
65,trademark fine art banksy matted black framed canvas art prints black canvas 16 x 20 hustler club,Collectibles
66,riddell speed mini helmet los angeles rams 2017,Collectibles
67,artsy canvas baseball bat city pride skylines on canvas toronto 36x24 canvas red,Collectibles
68,trademark fine art banksy gallery wrapped canvas art prints canvas 35 x 47 multi color better out than in,Collectibles
69,trademark fine art jai johnson 039 quiet observer bulldog puppy 039 canvas art 35 x 35 multi color,Collectibles
70,trademark fine art banksy gallery wrapped canvas art prints canvas 18 x 24 multi color ghetto for life,Collectibles
71,icanvas marc allante art on gallery wrapped canvas neighbours/26x18 dark,Collectibles
72,mojo mlb 21 hardcase spinner luggage toronto blue jays black/blue,Collectibles
73,design art large multi panel hand painted textured paintings and gallery wrapped canvas art canvas unframed brown,Collectibles
74,printerpix three personalized 10 x10 custom canvas prints red,Collectibles
75,merrick mint donald trump 45th president 24k gold clad official tribute coin yellow,Collectibles
76,one 36 x 24 custom canvas print,Collectibles
77,one 48x36 custom canvas print,Collectibles
78,canvas on sale 48 039 039 x 36 039 039 canvas,Collectibles
79,vintage hand embroidered hungarian matyo kalocsa doily handmade matyo small tablecloth,Collectibles
80,hand woven and hand embroidered raw silk scarf cocoon silk hand woven 3,Collectibles
81,nirvana poster flag group shot tapestry,Collectibles
82,romanian traditional wool head dress romanian woolen scarf /shawl green,Collectibles
83,new hand woven hand made romanian traditional belt black green,Collectibles
84,antique hand embroidered romanian costume from transylvania tinutul padurenilor size m,Collectibles
85,vintage hand embroidered hungarian matyo small table cloth 2,Collectibles
86,new hand woven romanian peasant costume. romanian ethnic outfit universal size,Collectibles
87,antique hand woven and hand embroidered romanian skirt universal size,Collectibles
88,green day poster flag mouse trap logo tapestry,Collectibles
89,pantera poster flag high noon your doom tapestry,Collectibles
90,hand embroidered hungarian matyo blouse /size xs s code rog,Collectibles
91,hand embroidered matyo hungarian blouse size xl rr ro code,Collectibles
92,romanian traditional footwear opinci size 43 44,Collectibles
93,marilyn manson poster flag born villain tapestry,Collectibles
94,vintage hand embroidered hungarian matyo kalocsa shawl,Collectibles
95,vintage romanian traditional costume from oltenia size m or m/l 2,Collectibles
96,pair of romanian bottles with ladder and yoke built inside,Collectibles
97,hand embroidered matyo kalocsa hungarian blouse size s/ m no. 12,Collectibles
98,hungarian beaded headdress parta from kalotaszeg region green 4,Collectibles
99,merrick mint 2018 1 oz colorized 2 sided official .999 fine silver american eagle u.s. coin gray,Collectibles
100,ppla dress size 7 black girls skirts dresses 34801370,Crafts
101,roxy jacket size 7 black junior jackets outerwear 34995707,Crafts
102,monteau sleeveless blouse size 3 dark green junior tops 34896369,Crafts
103,lily white casual skirt size 11 black junior bottoms 34693534,Crafts
104,pink rose sleeveless blouse size 11 dark blue junior tops 34687869,Crafts
105,gap wool pullover sweater size 12 dark blue women 039 s sweaters sweatshirts 34699065,Crafts
106,the children 039 s place jeans size 14 blue boys bottoms 34623797,Crafts
107,marni dress size 12 blue girls skirts dresses 34308935,Crafts
108,old navy dress size 12 gray girls skirts dresses 34362361,Crafts
109,ralph by ralph lauren dress size 2t pink girls skirts dresses 34364956,Crafts
110,kidtopia long sleeve blouse size 5 red girls tops 34204166,Crafts
111,mossimo supply co. leggings size 11 black junior bottoms 34297716,Crafts
112,clavce pullover sweater size 4t light pink girls tops 34104120,Crafts
113,bebop romper size 7 black junior dresses 34087849,Crafts
114,gymboree long sleeve size 6 mo beige girls bottoms 33984001,Crafts
115,a. byer sleeveless top size 7 purple junior tops 33926665,Crafts
116,healthtex leggings size 5t dark blue girls bottoms 33815511,Crafts
117,gymboree sweater vest size 3t blue boys tops 33850822,Crafts
118,old navy pullover hoodie size 10 beige girls tops 33844528,Crafts
119,carter 039 s dress size 0 mo navy blue girls skirts dresses 33733406,Crafts
120,justice long sleeve t shirt size 7 coral girls tops 33706925,Crafts
121,calvin klein jeans cardigan size 12 mo brown boys tops 29765111,Crafts
122,old navy cardigan size 4 red women 039 s sweaters sweatshirts 33541772,Crafts
123,j. khaki long sleeve top size 4t dark purple girls tops 33383576,Crafts
124,mossimo long sleeve top size 0 coral junior tops 33434357,Crafts
125,disney skirt size 3t pink girls skirts dresses 33167174,Crafts
126,baby gap cords size 18 mo dark blue boys bottoms 33193959,Crafts
127,unionbay casual skirt size 3 tan junior bottoms 33101013,Crafts
128,carter 039 s dress size 12 mo yellow girls skirts dresses 32883928,Crafts
129,speechless 3/4 sleeve top size 16 navy blue girls tops 32695029,Crafts
130,carter 039 s short sleeve outfit size 0 mo white girls tops 32873666,Crafts
131,revolution dress size 8 gray girls skirts dresses 32834480,Crafts
132,old navy beanie size 10 purple girls accessories 32177992,Crafts
133,mossimo sleeveless blouse size 7 burgundy junior tops 30451675,Crafts
134,koala kids jeans size 9 12 mo blue girls bottoms 28854025,Crafts
135,carter 039 s jeggings size 0 mo dark blue girls bottoms 32093369,Crafts
136,gap kids outlet long sleeve top size 10 pink girls tops 31914433,Crafts
137,justice sleeveless blouse size 8 light blue girls tops 31910519,Crafts
138,carter 039 s leggings size 2t gray girls bottoms 31891554,Crafts
139,j brand cargo pants size 10 dark green women 039 s bottoms 31920041,Crafts
140,corkey 039 s kids fleece jacket size 3t light green girls jackets outerwear 31555521,Crafts
141,crazy 8 pullover sweater size 10 black girls tops 31566365,Crafts
142,rue21 pullover sweater size 7 brown junior tops 31500720,Crafts
143,jeanine johnsen long sleeve top size 14 navy blue girls tops 30849627,Crafts
144,garage casual skirt size 0 dark purple junior bottoms 30849227,Crafts
145,xoxo casual dress size na gray junior dresses 30722285,Crafts
146,h m dress size 6 light pink girls skirts dresses 30571477,Crafts
147,hooray by cynthia rowley dress size 9 12 mo gray girls skirts dresses 28934345,Crafts
148,baby togs tuxedo vest size 3 mo black boys jackets outerwear 30302401,Crafts
149,jumping beans cargo pants size 3t tan boys bottoms 28685860,Crafts
150,carter 039 s short sleeve outfit size 0 mo pink girls tops 29223183,Crafts
151,laura ashley short sleeve size 3 mo light pink girls bottoms 27168154,Crafts
152,justice jeans size 7 blue girls bottoms 28453649,Crafts
153,kitestrings sweater vest size 18 mo green boys tops 24931033,Crafts
154,gymboree dress size 6 mo pink girls skirts dresses 28280225,Crafts
155,marla wynne casual pants size 4 light green women 039 s bottoms 29082518,Crafts
156,gymboree khakis size 2t gray boys bottoms 29420086,Crafts
157,old navy cardigan size 8 gray women 039 s sweaters sweatshirts 29199908,Crafts
158,carter 039 s long sleeve size 0 mo coral girls bottoms 28427496,Crafts
159,baby gap dress size 0 mo light pink girls skirts dresses 35022458,Crafts
160,jojo maman bebe cords size 6 mo navy blue girls bottoms 34911476,Crafts
161,fever cardigan size 8 black women 039 s sweaters sweatshirts 34690195,Crafts
162,rue21 casual dress size 7 dark purple junior dresses 34614078,Crafts
163,tres bien u.s.a. sleeveless top size 11 red junior tops 34622062,Crafts
164,so jeans size 7 dark blue junior bottoms 34372096,Crafts
165,one clothing casual dress size 3 navy blue junior dresses 34311028,Crafts
166,genuine kids from oshkosh casual pants size 5t brown girls bottoms 30105111,Crafts
167,red camel 3/4 sleeve blouse size 14 white girls tops 34045868,Crafts
168,chaps cardigan size 8 red women 039 s sweaters sweatshirts 34293814,Crafts
169,zara dress size 8 tan girls skirts dresses 34056089,Crafts
170,hollister long sleeve blouse size 7 purple junior tops 34167086,Crafts
171,one world cardigan size 8 red women 039 s sweaters sweatshirts 34113815,Crafts
172,carter 039 s leggings size 12 mo red girls bottoms 34030555,Crafts
173,mossimo casual skirt size na gray junior bottoms 33795122,Crafts
174,baby gap outlet long sleeve turtleneck size 4t gray boys tops 33576828,Crafts
175,urban pipeline jeans size 8 black boys bottoms 33615232,Crafts
176,zeroxposur beanie size 8 black boys accessories 33483128,Crafts
177,old navy long sleeve blouse size 5t dark blue girls tops 33508523,Crafts
178,genuine kids from oshkosh casual pants size 4t tan girls bottoms 33366461,Crafts
179,cyrus 3/4 sleeve top size 4 pink women 039 s tops 33383837,Crafts
180,the children 039 s place skirt size 12 dark green girls skirts dresses 33199893,Crafts
181,mossimo supply co. casual dress size 0 light pink junior dresses 33232695,Crafts
182,palomino kids by c a khakis size 4 navy blue girls bottoms 33017691,Crafts
183,les tout petits dress size 14 pink girls skirts dresses 32916127,Crafts
184,zenana outfitters casual dress size 3 gray junior dresses 32985810,Crafts
185,enyce tank top size 10 blue girls tops 32862332,Crafts
186,american living cargo pants size 6 tan girls bottoms 32720546,Crafts
187,lily white casual skirt size 3 blue junior bottoms 30878062,Crafts
188,sonoma life style sweatpants size 12 mo coral girls sporting activewear 29834293,Crafts
189,baby gap short sleeve top size 6 mo light pink girls tops 31817952,Crafts
190,tommee tippee beanie size 0 mo blue boys accessories 30360252,Crafts
191,express tank top size 0 dark purple women 039 s tops 31816139,Crafts
192,hanna andersson long sleeve top size 7 blue girls tops 32253892,Crafts
193,sugar tart 3/4 sleeve top size 12 light pink girls tops 32032554,Crafts
194,zara kids sweatshirt size 10 gray boys tops 32163317,Crafts
195,northern isles dress pants size 12 black women 039 s bottoms 28490628,Crafts
196,mossimo cardigan size 7 burgundy junior sweaters sweatshirts 31848886,Crafts
197,george special occasion dress size 16 pink girls skirts dresses 31655746,Crafts
198,gap kids long sleeve turtleneck size 6 dark blue girls tops 30734466,Crafts
199,carter 039 s cardigan size 0 mo teal girls tops 27166591,Crafts
200,vaporesso tarot nano vaporizer from hookah town starter kit black,Esoteric and Occult Products
201,vaporesso tarot nano vaporizer from hookah town green,Esoteric and Occult Products
202,women 039 s airwaves llc spinning fitness tanks medium 2 4 athletic heather cant spell legendary without led day grey,Esoteric and Occult Products
203,vaporesso tarot nano vaporizer from hookah town black,Esoteric and Occult Products
204,women 039 s airwaves llc spinning fitness tanks xx large 12 14 athletic heather cant spell legendary without led day grey,Esoteric and Occult Products
205,vaporesso tarot nano vaporizer from hookah town starter kit chrome,Esoteric and Occult Products
206,women 039 s airwaves llc spinning fitness tanks large 6 8 athletic heather cant spell legendary without led day grey,Esoteric and Occult Products
207,vaporesso tarot nano vaporizer from hookah town starter kit red,Esoteric and Occult Products
208,women 039 s airwaves llc spinning fitness tanks small 0 2 athletic heather cant spell legendary without led day grey,Esoteric and Occult Products
209,women 039 s airwaves llc spinning fitness tanks x large 10 12 athletic heather cant spell legendary without led day grey,Esoteric and Occult Products
210,vaporesso tarot nano vaporizer from hookah town red,Esoteric and Occult Products
211,vaporesso tarot nano vaporizer from hookah town chrome,Esoteric and Occult Products
212,vaporesso tarot nano vaporizer from hookah town starter kit green,Esoteric and Occult Products
213,now foods lavender essential oil 4 oz bottle,Home Decor
214,pure plant home coconut wax candle jar lavender 3.1 oz jar,Home Decor
215,elsa medium glass tea light candle holder,Home Decor
216,white clear cupped tea lights set of 25,Home Decor
217,recycled glass short hurricane candle holder,Home Decor
218,diptyque myrrhe for women by diptyque scented candle 6.5 oz,Home Decor
219,jardins d 039 ecrivains zweig for women by jardins d 039 ecrivains candle 6 oz,Home Decor
220,white 3 x3 pillar candle,Home Decor
221,element metal antiqued pewter vase,Home Decor
222,geo vase,Home Decor
223,aura cacia organic lemon eucalyptus essential oil 0.25 oz bottle,Home Decor
224,now foods ultrasonic oil diffuser 1 diffuser,Home Decor
225,gerald small round wall mirror,Home Decor
226,hunter vase,Home Decor
227,faith with light wood frame 31.5 x25 by cb2,Home Decor
228,bums white on black with light wood frame 29.5 x39.5 by cb2,Home Decor
229,kansas pivot irrigation with light wood frame/no mat 30.5 x40.25 by cb2,Home Decor
230,city bike blues with dark wood frame 31.5 x43.5 by cb2,Home Decor
231,the female gaze with pewter frame 15.5 x17.75 by cb2,Home Decor
232,wyatt wood and brass mirror 32 by cb2,Home Decor
233,aesthetics ultrasonic wood grain diffuser with essential oils set 8 pack light wood,Home Decor
234,2 piece wick trimmer and candle snuffer set by cb2,Home Decor
235,pools with light wood frame 25.5 x19.5 by cb2,Home Decor
236,arm hammer under the seat gel air fresheners 3 pack 3 pack air fresheners lilac and jasmine yellow,Home Decor
237,nba hardwood classics chrome neon clock portland trail blazers,Home Decor
238,team sports america nhl bluetooth ticket stub scoreboard wall clocks with speakers chicago blackhawks,Home Decor
239,easy living with dark wood frame 16.5 x16.5 by cb2,Home Decor
240,nhl chrome double rung neon clock watermark logo vintage options logo tampa bay lightning,Home Decor
241,numi 1 ring taper candleholder by cb2,Home Decor
242,sunset with light wood frame 24.5 x18 by cb2,Home Decor
243,team sports america ncaa bluetooth scoreboad wall clock oregon multi color,Home Decor
244,kathleen with black frame 43.5 x31.5 by cb2,Home Decor
245,singapore tankers with pewter frame/no mat 41.5 x25.5 by cb2,Home Decor
246,dinkleboo one 11x8 50 page hard cover photo book,Home Decor
247,rooftop with gold frame 25.5 x19.5 by cb2,Home Decor
248,london with gold frame/no mat 27.5 x40.5 by cb2,Home Decor
249,sunset with black frame 40.5 x28 by cb2,Home Decor
250,gallery walnut 11x14 picture frame with linen mat by cb2,Home Decor
251,etna grey short planter by cb2,Home Decor
252,sophia with black frame 31.5 x43.5 by cb2,Home Decor
253,afternoon sun with pewter frame 23.5 x31.5 by cb2,Home Decor
254,beach life with black frame 31.5 x43.5 by cb2,Home Decor
255,gallery brushed silver 5x7 picture frame by cb2,Home Decor
256,keep swimming with light wood frame 29.5 x36 by cb2,Home Decor
257,zennery gold mosaic glass ultrasonic diffuser t4 and 3 essential oils 1 oz 3 1oz essential oils green/yellow,Home Decor
258,team sports america nhl bluetooth ticket stub scoreboard wall clocks with speakers minnesota wild,Home Decor
259,lawrence frames 5x7 blue wood picture frame gallery collection blue 8x10,Home Decor
260,central park with light wood frame 25.5 x34.5 by cb2,Home Decor
261,christy with light wood frame 25.5 x19.5 by cb2,Home Decor
262,canvas on sale one 20x16 one 16x12 and one 12x8 custom canvas,Home Decor
263,nba hardwood classics chrome neon clock chicago bulls,Home Decor
264,rooftop with gold frame/no mat 40.5 x27.5 by cb2,Home Decor
265,manzanita beach with black frame/no mat 31.5 x41 by cb2,Home Decor
266,delray beach with dark wood frame/no mat 33.5 x33.5 by cb2,Home Decor
267,reservoir houseboats with white frame 25.5 x19.5 by cb2,Home Decor
268,nhl chrome double rung neon clock watermark logo vintage options watermark tampa bay lightning,Home Decor
269,6 pack little trees hanging air freshener pina colada,Home Decor
270,geode small slice by cb2,Home Decor
271,gallery walnut 8x10 picture frame with grey mat by cb2,Home Decor
272,printerpix twenty 11 039 039 x8.5 039 039 personalized 40 page hard cover photo books,Home Decor
273,monq portable essential oil diffusers active orange sage black pepper blue,Home Decor
274,monq portable essential oil diffusers mountain juniper peppermint pine silver,Home Decor
275,nu yuu 100 pure therapeutic grade essential oils 30ml 3 pack spring cleaning natural,Home Decor
276,lupa white large planter by cb2,Home Decor
277,malaysian palms with white frame 31.5 x31.5 by cb2,Home Decor
278,lamplust flameless led candles set of 3 baby blue flickering or steady baby blue,Home Decor
279,pitch purple planter by cb2,Home Decor
280,hawk round wall mirror 24 by cb2,Home Decor
281,portland river walk with light wood frame 21.5 x27 by cb2,Home Decor
282,fan creations nba round distressed sign magic,Home Decor
283,gallery black 11x14 picture frame with grey mat by cb2,Home Decor
284,potted 65 fiddle leaf fig by cb2,Home Decor
285,aesthetics lava stone chakra diffuser bracelet white/without essential oils,Home Decor
286,table and chairs with gold frame 25.5 x19.5 by cb2,Home Decor
287,two rivers with pewter frame/no mat 41.5 x30.5 by cb2,Home Decor
288,evil eye with pewter frame 13.5 x13.5 by cb2,Home Decor
289,addis ababa agriculture with white frame 31.5 x31.5 by cb2,Home Decor
290,driven air fresheners black out air fresheners 6 pack black out,Home Decor
291,baby gift idea mommy and me photo frame black/red/gray,Home Decor
292,zennery bamboo and glass ultrasonic aroma diffuser and 2 essential oils 1 oz 2 1oz essential oils,Home Decor
293,aesthetics lava stone diffuser bracelet gold/without essential oils,Home Decor
294,artnaturals top 8 essential oils and oil diffuser set 9 piece,Home Decor
295,yankee candle large classic jar multiple scents available midsummer night,Home Decor
296,firstime co. wall clocks brown analog 11 walnut round wall clock white,Home Decor
297,aesthetics lava stone diffuser bracelet gray/without essential oils,Home Decor
298,aesthetics lava stone diffuser bracelet gray/optional essential oils,Home Decor
299,antigua with black frame 23.5 x29.5 by cb2,Home Decor
300,rooftop with white frame/no mat 40.5 x27.5 by cb2,Home Decor
301,aesthetics ultrasonic diffuser and humidifier with oil set 9 piece,Home Decor
302,zennery negative ion essential oil aroma diffuser/nebulizer and 2 essential oils 0.5 oz bergamot and cedarwood,Home Decor
303,sunset with black frame 24.5 x18 by cb2,Home Decor
304,izzybell jewelry terracotta aromatherapy car diffusers 16 styles black circle terracotta essential oil car diffuser,Home Decor
305,izzybell jewelry essential oil diffuser 5 stone lava rock wrap bracelet red/natural,Home Decor
306,team sports america ncaa bluetooth scoreboad wall clock multi color kansas jayhawks,Home Decor
307,suki tab round metal mirror 24 by cb2,Home Decor
308,6 pack little trees hanging air freshener wild cherry red,Home Decor
309,aesthetics lava stone diffuser bracelet blue rose gold with 2 essential oils pink/red/blue/yellow,Home Decor
310,lawrence frames black wood double 4x6 matted picture frame black 4x6 triple,Home Decor
311,the usb lighter flameless usb candle lighter white,Home Decor
312,lawrence frames 11x14 dual use silver aluminum document frame 11x14 silver,Home Decor
313,four 12x12 039 039 premium thick wrap canvas prints,Supplies
314,crocs cerulean blue baya shoes,Supplies
315,canvas on sale three 20 x16 forex photoboards,Supplies
316,playtek creative paint it yourself plaster art paint set dinosaurs,Supplies
317,10 x10 wooden 3/4 039 039 photoboard red/light/dark,Supplies
318,11 x14 wooden 3/4 039 039 photoboard red/light/dark,Supplies
319,16 x20 wooden 3/4 039 039 photoboard red/light/dark,Supplies
320,canvas on sale four 20 x16 forex photoboards,Supplies
321,thornton 039 s art supply acrylic paint set 75ml unisex adult,Supplies
322,5 x7 wooden 3/4 039 039 photoboard red/light/dark,Supplies
